,Date,Review_Score,Review_Text
1,"December 4, 2018",3,missing offline possibility. often bugs preventing opening articles. good articles.
2,"July 12, 2019",2,"har hatt problemer tidligere med at jeg ofte blir logget ut, men n친 f친r jeg ikke tilgang i det hele tatt til artikler ""for abonnenter"", til tross for at jeg er abonnent og logget inn. h친per dette blir fikset snart."
3,"April 24, 2019",4,krasjer hver gang jeg fors칮ker 친 lese en artikkel. ser ut til 친 v칝re relatert til en oppdatering
4,"February 15, 2019",2,"har store problemer med appen p친 nettbrett android galaxy. f친r beskjed om at appen er oppdatert og kan installeres p친 nytt,men lenken g친r bare til apple oppdateringen som ikke er kompatible med nettbrettet. dermed er den helt ubrukbar. p친 telefonen (ogs친 android) fungerer den fint."
5,"February 10, 2019",1,"f친r ikke opp nyheter etter 6. februar, og f친r stadig feilmelding om at sesjonen min er utl칮pt og at jeg m친 logge inn p친 nytt."
6,"February 23, 2019",1,"umulig app. m친 laste ned annenhver dag fordi f친r stadig melding om at jeg har lest 6 gratis artikler, og oppfordring om 친 bli abonnent - til tross for at jeg er abonnent og innlogget. nytter ikke 친 logge av og p친 igjen heller. kun 친 laste ned app'en p친 nytt. sv칝rt misforn칮yd, og null hjelp fra aften...full review"
7,"March 6, 2019",2,"f친r ikke tilgang til forsiden av aftenposten p친 android nettbrett pga info om ny app. denne appen gjelder kun apple brukere men f칮rer til at jeg ogs친 utestenges. kommer en fix p친 dette snart? jeg ser at dette er fikset. det er fint, men n친 er det ikke mulig 친 logge seg inn p친 nettbrettet."
8,"January 3, 2019",2,mottar alt for mange varsler etter at telefonen ble oppdatert til android pie. ofte varsler jeg har sett f칮r som er opp til flere dager gamle
9,"June 28, 2018",4,hva med en daglig offline seksjon. d친rlig dekning p친 toget:) ellers bra.
10,"May 11, 2018",3,"ikke en spesielt bra app. lite mulighet for personalisering og samtidigvis 
mange un칮dvendige funksjoner. er ikke vits i 친 lese aftenposten hver dag 
siden mange av de gamle nyhetene forblir p친 ""forsiden"" og det er n칝rmest 
umulig 친 finne enkelt frem til nytt stoff eller finne frem til gammelt men 
...full review"
11,"April 9, 2018",2,游 har autoavspilling av video i nettsiden. ikke forbrukervennlig n친r det kommer til mobil databruk. ingen funksjon for 친 sl친 det av enn친.
12,"April 8, 2018",3,"funker ok. videoer starter sjelden og det er ikke mulig 친 scrolle i appen n친r man scroller p친 direktebloggen.  oppdatering etter oppdateringen :) : scrolling i direktebloggen er n친 ok, flott. liten bug der enn친; media vises ikke i direktebloggen og det vises et sort panel med en snurrende sirkel der...full review"
13,"March 28, 2018",4,"helt 친lreit, men den er treg med 친 gjenkjenne at jeg er innlogget n친r jeg starter den. ofte er tilbake - knappen ganske treg ogs친. ellers savner jeg 친 kunne lese aftenposten som e-avis, og 친 kunne lese aftenposten innsikt."
14,"March 8, 2018",5,sport live linken virker ikke lengre. kommer bare inn p친 side med sportssaker. android 8.1
15,"March 4, 2018",5,siste oppdatering took den ut av sirupskrukka. n친 친pnes artikler umiddelbart. (note8)
16,"March 5, 2018",4,er det mulig 친 finne aftenpostens lederartikkel i appen?
17,"December 17, 2017",2,"brukte denne appen for nyhetsvarsel, men det har sluttet helt 친 fungere. for 친 lese selve avisa er fortsatt nettsida veldig mye bedre. og hvorfor insisterer appen 친 친pne ting i chrome og ikke i standard nettleser?"
18,"December 13, 2017",2,fremdeles problemer med widget for android 8.0. ingen mulighet for 친 oppfriske widget og den viser dermed gamle nyheter
19,"November 4, 2017",2,appen viser reklame selv om man har betalt abonnement. double dipping kalles det. har sagt opp abonnementet og kommer ikke tilbake f칮r reklamen er borte.
20,"November 20, 2017",1,"denne appen har sluttet 친 fungere normalt. n친r jeg klikker p친 en artikkel p친 forsiden f친r jeg en blank side mesteparten av tiden. jeg venter lenge i h친p om at artikkelen skal lastes, men ingen ting skjer. g친r tilbake og pr칮ver p친 nytt med samme resultat. bruker jeg en nettleser p친 telefonen i steden...full review"
21,"December 11, 2017",2,"treg, d친rlig brukergrensesnitt og irriterende varsling inne i appen. aftenposten har mye bra innhold s친 merkelig at de ikke bruker litt mer ressurser p친 친 presentere det p친 en skikkelig m친te"
22,"October 27, 2017",3,"litt utdatert, st칮tter ikke p친logging med fb / google og reklame vises selv om en har kj칮pt abbonement. gir ikke mulighet til 친 ikke legge inn vurdering."
23,"October 27, 2017",4,funker fjell og jeg f친r servert nyheter dagen lang. g친r helt greit 친 logge inn. irriterende med all reklamen n친r man faktisk betaler for 친 slippe.
24,"December 7, 2017",1,"gang p친 gang p친 gang p친 gang m친 jeg starte appen p친 nytt, fordi den viser den f칮rste artikkelen jeg klikker meg inn p친, men p친 den neste artikkelen ser jeg kun en tom side. grunn nok til 친 si opp abonnementet ogs친 for meg.   selvf칮lgelig viser de reklame ogs친 n친r man har abonnement, det er tross alt...full review"
25,"November 13, 2017",4,"grei app, men noen enkelte ganger klarer ikke den 친pne artikler."
26,"November 8, 2017",5,a man's not hot.
27,"October 17, 2017",2,betaler 200 kroner i m친neden men fremdeles full av reklameannonser.
28,"October 7, 2017",3,have to re log in all the time.
29,"December 14, 2017",3,no
30,"August 4, 2017",3,"god leseropplevelse, men opplever noen irriterende situasjoner der jeg blir bedt om 친 logge inn selv om jeg betaler for abonnement, der back-knappen ikke virker og linker ikke virker."
31,"August 7, 2017",4,"ok m친te 친 lese aftenposten p친, ikke helt funnet kjempemange argumenter for appen vs. nett."
32,"August 16, 2017",5,very good news app
33,"August 26, 2017",5,love it
34,"June 25, 2017",1,no changelog for permission change
35,"July 4, 2017",5,"working probably, feels smooth :)"
36,"February 19, 2017",4,en del enkle designgrep kunne gjort appen mye bedre. alt i alt en grei opplevelse.
37,"February 2, 2017",1,"hvis man betaler 200,- i m친neden er appen kjempebra, men det er en saftig pris 친 betale. hvis man har gratisversjonen kan man kun lese 6 artikler i uka, noe som er alt for lite....  da blir det vg eller dagbladet p친 meg.  edit: betaler man ville jeg kalt appen for 4 stjerner fordi jeg savner mulighe...full review"
38,"March 23, 2017",4,good coverage of norwegian and international  news
39,"March 22, 2017",5,love it. needs tabs though
40,"December 24, 2016",3,vanskelig 친 registrere seg for 친 bli abonnent. mange bilder blir ikke vist/oppdatert. link til nyhetsvarsler ender ofte i en blank side. samsung galaxy s7. ellers en glimrende nyhetsformidler.
41,"January 6, 2017",5,rask til 친 laste inn alt innhold! god oversikt og lett 친 bruke
42,"November 18, 2016",3,for mange nyhetsvarsler og ikke mulig 친 filtrere
43,"November 29, 2016",5,bare greit.
44,"November 5, 2016",2,"galaxy note 3, android 5"
45,"November 7, 2016",3,"litt clickbait, ellers greit"
46,"November 6, 2016",4,okay
47,"August 30, 2016",5,i'm finding this very helpful while learning the language
48,"June 28, 2016",5,har ikke hatt noen problemer med app-en
49,"July 28, 2016",1,noen andre som opplever det?
50,"May 4, 2016",5,veldig bra!
51,"July 18, 2016",4,bra app og ikke minst en avis som ser ut til 친 st친 st칮tt i forhold til flere andre
52,"March 19, 2016",2,"n친 har det etterhvert blitt flere artikler som ikke vises, enn de som gj칮r det. f친r kun blanke sider p친 sv칝rt mange av artiklene. innloggingsystemet er heller ikke veldig godt, det glemmer at jeg er innlogget (ogs친 p친 nett, ikke bare i appen) eller s친 p친st친r det at det ikke er noe abonnement p친 kont...full review"
53,"March 22, 2016",3,veldig bra design... men det er en bug som gj칮r det at den hopper p친 toppen av siden mens jeg leser... s친 mp jeg skrolle ned flere ganger for 친 lese ferdig en artikkel. og aaalt for mange reklamer.
54,"April 4, 2016",2,"fungerer rett og slett bare bedre 친 친pne nettsiden deres i nettleseren i stedet. navigasjon henger litt, blir ikke ordentlig full skjerm i aftenposten tv + litt i overkant med varsler."
55,"March 10, 2016",5,"etter siste oppdatering gikk appen fra 친 v칝re nesten ubrukelig, til 친 funke. fortsett med oppdateringene!"
56,"February 23, 2016",5,"i use this app to stay informed about norwegian politics and learn the norwegian language, so i can hopefully study in norway in two years."
57,"February 19, 2016",1,"sjelden har jeg opplevd en mer ustabil app enn denne. den krasjer regelmessig, klarer ikke 친 huske meg som innlogget bruker og serverer ofte en gr친 skjerm fremfor 친 vise innholdet av en valgt artikkel. at noen skulle v칝re interessert i 친 betale kr 300 pr. mnd. for et s친 d친rlig produkt er ubegripelig...full review"
58,"January 28, 2016",5,"fortsatt en bra app p친 5.1 (lollipop,) rask, ser bra ut, men l친ser seg en liten gang iblant. synes dere gj칮r en god jobb. en ting jeg har 친 klage p친 er notifikasjonene, n친r de ekspanderes f친r man bilde, men teksten er fortsatt kuttet (den fulle teksten er mer interessant.)"
59,"December 27, 2015",4,liker spesielt osloby
60,"January 5, 2016",5,bra!
61,"November 3, 2015",5,aftenp 4eva xoxo
62,"October 13, 2015",4,"noks친 likt nettleser, p친 godt og vondt. men fint om det blir mulig 친 fjerne ""dele/like""-knappene 칮verst p친 venstre side og nederst til h칮yre. p친 min skjerm dekker de alltid en del av artikkelen, jeg vil heller dele fra menyen."
63,"October 6, 2015",4,very briefing
64,"September 23, 2015",3,"jeg er forn칮yd med utforming og hastighet, men som abonnent, hvorfor blir jeg utsatt for reklamer og forslag om 친 bli abonnent? da kan jeg jo like gjerne lese avisen i nettleser med adblock."
65,"September 19, 2015",5,veldig forn칮yd med aftenposten-appen!
66,"August 29, 2015",3,etter siste oppgradering er den blitt litt ustabil.
67,"September 3, 2015",4,very good news app.
68,"July 5, 2015",1,siste versjon viser ofte blank side istedenfor artikkel p친 min samsung s3.
69,"July 21, 2015",5,enkel og grei fin app :)
70,"May 29, 2015",5,well designed. easy to navigate
71,"May 11, 2015",2,articles are stacked on top of each other do its impossible see what the article is about without opening the article.
72,"May 11, 2015",3,"n칝rmer seg :) spaltene er n친 i orden, men oppdatering av skjermbildet lenge etter at siden er lastet inn er fremdeles et problem."
73,"May 20, 2015",4,"bra app n친! reklamen er likevel irriterende plassert, og nye artikler blir ikke pre-loadet. men alt i alt s친 er appen stabil og fungerer som tenkt. en stor forbedring! klaget p친 animasjonene ogs친, men de var visst i den andre ap-appen :)"
74,"May 12, 2015",5,veldig bra!!
75,"April 19, 2015",1,etter siste oppdatering f친r jeg ikke installert appen. f친r bare beskjed om at appen ikke er kompatibel. selvsagt s친 ble gammel versjon fjernet under oppdateringen.
76,"April 8, 2015",4,"funker bra, men fortsetter 친 laste ned slik at skjermbildet hopper oppover i starten."
77,"April 2, 2015",5,s칝rdeles rask feilretting. imponerende
78,"March 21, 2015",5,super!
79,"February 4, 2015",3,"denne appen kunne v칝rt s친 mye, mye bedre. opplever ofte at det er referanser til andre artikler / eksterne kilder som man ikke kan klikke p친. dessuten er den treg, og gir ikke mulighet for 친 lagre artikler man liker. noe jeg ogs친 savner er en slags ""pack & go "" funksjonalitet, som gj칮r det mulig 친 s...full review"
80,"January 20, 2015",3,"fremdeles litt ustabil og noe treg, innholdet er bra."
81,"January 11, 2015",5,men hvorfor tar ikke push-notification-beskjedene meg til selve artikkelen? hvorfor m친 jeg scrolle gjennom hele forsiden for 친 finne den?
82,"January 16, 2015",3,helt p친 trynet at det er x antall gratis dager. ellers er det en av de beste nyhetsappene.
83,"December 8, 2014",4,"bra design osv, men den henger seg hele tiden n친r jeg blar rundt. (siden stopper, men jeg fortsatt bruke side menyen osv) og fortsatt ingen fullskjerm video."
84,"December 8, 2014",1,ubrukelig. henger seg opp hele tiden! m친 inn i appmanager for 친 lukke den f칮r den fungerer igjen..i noen f친 minutter. etter den siste oppdateringen og 200 liter kaffe fungerer den fremdeles ikke!!
85,"November 17, 2014",2,"oppdatering: samme problem, men hoppingen gj칮r seg ferdig mye kjappere enn tidligere. mindre irriterende har det blitt, det er faktisk mulig 친 bruke appen n친 hvis man gir den ett par sekunder f칮r man begynner 친 scrolle. stor forbedring...    ""lasting av reklamen f칮rer til at det hopper tilbake til t...full review"
86,"November 1, 2014",5,er ikke hver dag man ser en app bygd s친 godt for kitkat!
87,"October 3, 2014",2,"den evig repeterende lasting av de tre millioner annonser og reklamer gj칮r at sidene til stadighet hopper opp til toppen igjen. en har valget mellom frustrert scrolling ned til punktet man ble avbrutt i, eller 친 legge fra seg mobilen i fem minutter til alt forstyrrende m칮kk er ferdig lastet. dette p...full review"
88,"October 2, 2014",3,"litt treig, litt rotete."
89,"June 30, 2014",2,bare tekst og hvit skjerm.  styr unna. hver gang. pr칮ver 친 resette cashe. pr칮vde p친 chrome og m친 refreshe en del ganger til jeg f친r fram bilde osv.
90,"June 27, 2014",4,quite good but not awesome. i read aftenposten from seattle.
91,"June 2, 2014",4,like what i said.
92,"April 11, 2014",2,etter oppdateringen har den blitt treg og hopper ofte til toppen av siden. ikke et produkt jeg ville betalt for.
93,"April 21, 2014",3,"heilt  alright, bra paa oppdateringer men det hender at det stopper  opp  noen ganger."
94,"March 29, 2014",2,"sider er neddynget med blinkende reklame (칝rlig talt, 6 reklamer p친 en liten nyhetssak?) som gj칮r de tunge 친 laste og f친r de til 친 hoppe opp og ned f칮r de er ferdig lastet. bedre i vanlig nettleser, selv om antall reklamer er det samme."
95,"March 29, 2014",5,"gode funksjoner som flyter i god moderne android design.   varslene er ogs친 gode, da de ikke er plagsomme. viktige saker kommer opp, ikke reklame og ordin칝re hendelser."
96,"March 21, 2014",4,"ser grei ut, men hakkete scrolling og d친rlig respons. forel칮pig er nettsiden bedre."
97,"February 23, 2014",2,de foskjellige sideelementene8 leses og formatteres i vilk친rlig rekkef칮lge. resultatet er at tekster og bilder fyker rundt til alt er lastet. ikke bra.
98,"March 4, 2014",1,reklamen ser ut til 친 m친tte ta skylden. av og til tar det lang tid f칮r en side lastes. som et gulp fra gamle web tider.
99,"February 19, 2014",4,den er bra:)
100,"February 3, 2014",4,love the content and love that the app follows many of the android design guidelines.  navigation is confusing when there are stacked navigation menus.
101,"January 23, 2014",5,"ap dekker innenriks- og utenriksnyheter bedre enn noen annen norsk avis. kunne ha 칮nsket meg mer problematiserende daglig journalistikk,  men dette gj칮re i st칮rre temaartikler."
102,"December 22, 2013",3,om du har lyst til 친 lese aftenposten med reklame er dette appen for deg
103,"January 16, 2014",1,pay for news? no thanks!
104,"December 29, 2013",5,it works beautifully with my android.
105,"December 7, 2013",1,appen g친r ikke an 친 친pne. betaler ikke for abonnement s친 lenge appen er ubrukelig.
106,"December 10, 2013",1,veldig treg! widget har feil lenker
107,"November 30, 2013",4,"works splendid on my htc one.  and the editorial profile fits the design.  please, continue to keep the nonsense news out of ap. do not mind paying for quality."
108,"November 30, 2013",2,"l친ser seg ofte og annonsene flytter seg slik at man m친 scrolle opp hele tiden for 친 lese artikler. veldig irriterende, velger ofte andre medier for nyheter n친r dette skjer."
109,"November 28, 2013",4,denne er s친 bra at man glemmer det bare er mulig 친 lese aftenposten med den. her er det mye 친 l칝re for andre! full score n친r video plug in fungerer som den skal.
110,"November 26, 2013",2,"meningsl칮st 친 ikke bruke native code p친 en slik app, selve forsiden er bare en nettside embeded i appen."
111,"November 30, 2013",4,jeg liker konseptet med nyhetsvarselet... men det hadde v칝rt bedre om vi kunne egendefinerte hva som er en viktig nyhet. med n칮kkelord eller noe?
112,"December 1, 2013",5,"rask, enkel og innbydende."
113,"November 26, 2013",3,"designet virker flatt og inviterer ikke noe s칝rlig til 친 bla videre i de forskjellige seksjonene. skulle gj칝rne hatt et mer helhetlig design, se til de st칮rre mediehusene i europa hvordan de har l칮st dette. guardian f.eks eller faktisk ria novosti."
114,"November 24, 2013",3,"""nye"" aftenposten kj칮rer betydelig tregere enn tidligere versjoner. f친r h친pe at betal-utgaven er bedre."
115,"November 24, 2013",5,et s칝rdeles godt alternativ til tabloidsuppa!
116,"November 22, 2013",5,excellent
117,"November 7, 2013",4,"god avis, ok app"
118,"November 25, 2013",2,sykelig ustabil
119,"January 9, 2014",2,"var tynt i starten, men n친 kommer det seg :-)"
120,"October 31, 2013",1,keeps crashing
121,"August 1, 2013",3,"videoer fungerer kun under videofanen, aldri n친r de ligger i artikler. p친 xperia tablet z har siste oppdatering fjernet landscape view. annonsene p친 h칮yre del av siden er speilvendt. mulig feilen ikke er i appen."
122,"August 16, 2013",3,"klikker for mange ganger, ellers er den en fin app."
123,"July 6, 2013",3,"videoer vises ikke, bare lyd. brukergrensesnitt er ok. knapper p친 bildesliden kan tenkes som video. den trenger fiksing"
124,"May 28, 2013",2,"jeg venter fortsatt p친 at de skal fikse appen s친 jeg faktisk kan f친 lese artiklene uten 친 m친tte pr칮ve flere ganger. hos meg fryses bildet 칮verst i artikkelen, og jeg f친r ikke scrollet nedover. eller forsidebildet vokser og vokser s친 resten av artikkelen hopper nedover. det er veldig irriterende, vet...full review"
125,"May 5, 2013",2,"til tross for god wifi-deknig, laster sidene ekstremt langsomt. forsiden er for bred for skjermbredden til en transformer-pad, og aplikasjonen kr칝sjer omtrent hver gang jeg bruker den."
126,"March 12, 2013",4,four stars again after crashing stopped.
127,"February 15, 2013",2,"ser ut til at den siste versjonen har fikset krasj ved 친pning av notifications, men n친 tryner den ved scrolling p친 forsiden veldig ofte..."
128,"February 17, 2013",1,telefonen l친ser seg heletiden.
129,"November 16, 2012",1,"hadde litt glede av denne appen ens stund p친 min nexus 7 tablet, men etter at jeg fikk oppdatert android til 4.2 fungerer den ikke lenger. krasjer ved oppstart. fungerer fint p친 htc s telefonen."
130,"January 14, 2013",1,appen krasjer konstant p친 min galaxy tab 2. slik jeg har forst친tt det s친 er det fordi appen ikke er kompatibel med nyeste versjon av android. fiks problemet!
131,"June 1, 2013",5,"oversiktlig, enkel 친 bruke og stabil. anbefaler denne appen p친 det sterkeste!"
132,"January 17, 2013",5,utrolig bra app sammenlignet med dag og vg som ikke tar deg tilbake til siden du var p친. er du halvveis ned p친 sidrn tar denne deg tilbake der du var n친r du har lest en side. ingen andre store tabloidavisene gj칮r dette.
133,"December 27, 2012",1,kr칝sjer pa nexus 7 med android 4.2
134,"December 28, 2012",2,fc
135,"August 9, 2012",1,"won't even start  kr칝sjer p친 oppstart, er det et problem med jelly bean eller nexus 7?"
136,"July 1, 2012",1,samsung galaxy tab 2 7.0
137,"July 13, 2012",1,starter ikke en gang
138,"May 4, 2012",4,zoom funksjon mangler. det som gj칮r nettsidene bedre
139,"December 28, 2011",1,"nettleseren p친 mobilen laster sidene ca. 14 ganger raskere. rett og slett ubrukelig. skjermtaster som tar altfor mye ned trekker ytterligere ned (om mulig). hallo, vi har en menytast p친 android-telefoner..."
140,"January 14, 2012",1,"dritt! gode nyheter, men scroller seg til toppen hele tiden. android 4"
141,"April 26, 2011",1,amat칮rmessig. ingen fingerscrolling. fungerer p친 helt annen m친te enn p친 ipad. ser ut som egen browser til websidene deres istedenfor ordentlig app.
142,"February 13, 2011",2,rotete. zoom med fingrene virker ikke. forstyrrende zoom-knapper over artiklene og forstyrrende menyknapper i bunn. d친rligere enn normal a-nettside.
143,"March 21, 2011",3,strukne bilder om en ikke zoomer s친 langt ut at ikke kan lese teksten.. fint med tilgangen til siste videoer.
144,"March 16, 2011",3,"bildene er strukket ut i h칮yden p친 nexus one, slitsomt 친 lese.."
145,"February 4, 2011",1,s친 treg at den er ubrukelig.
146,"February 11, 2011",4,fantastisk p친 galaxy tab
147,"March 25, 2012",3,"iphone versjonen er mye raskere enn denne, burde fikses"
148,"February 1, 2011",1,drm p친 appendix - teit. bildene blir dratt. trenger en god del jobb.
149,"January 25, 2011",2,dette er jo bare tull. savner den opprinnelige appen p친 iphone. den viser sakene enkelt og greit. dette er jo bare nettsiden men mye tregere
150,"January 26, 2011",1,lite eller ingen ekstra verdi utover websidene. kan ikke installeres p친 sd! fail!
151,"January 21, 2011",1,lite responsiv og forcecloser p친 nexus s. bildene er ogs친 veldig dratt i h칮yden.
152,"January 29, 2011",3,helt grei. h친per p친 oppdateringer for 친 gj칮re appen bedre. 5 stjerner etter noen forbedringer.
153,"January 28, 2011",3,bedre 친 bruke den vanlige browseren.
154,"November 25, 2013",1,"""unfortunately aftenposten has stopped"" er beskjeden jeg f친r hver gang jeg i det hele tatt pr칮ver 친 친pne denne appen. jeg har restartet tlf. avinstallert og reinstallert til ingen nytte."
155,"November 25, 2013",1,rett etter p친logging crashet appen. lettere 친 lese p친 nettleseren. sony xperia
156,"October 23, 2013",5,endelig en oppdatering det smaker fugl av. litt mer speed n친 s친 begynner det 친 hjelpe!
157,"August 9, 2018",1,"ustabil, stadige utlogginger, d친rlig navigasjon. dette er ikke bra nok i 
2018."
158,"December 25, 2013",2,begrenset antall artikler per m친ned
159,"July 26, 2012",4,bunker for meg
