,Name,Date,Review_Score,Review_Text
1,Preben Stor친s,"December 4, 2018",3,Missing offline possibility. Often bugs preventing opening articles. Good articles.
2,Tonje Olsrud,"July 12, 2019",2,"Har hatt problemer tidligere med at jeg ofte blir logget ut, men n친 f친r jeg ikke tilgang i det hele tatt til artikler ""for abonnenter"", til tross for at jeg er abonnent og logget inn. H친per dette blir fikset snart."
3,Thomas Emil Dagsvik,"April 24, 2019",4,Krasjer hver gang jeg fors칮ker 친 lese en artikkel. Ser ut til 친 v칝re relatert til en oppdatering
4,A Google user,"February 15, 2019",2,"Har store problemer med appen p친 Nettbrett Android galaxy. F친r beskjed om at appen er oppdatert og kan installeres p친 nytt,men lenken g친r bare til Apple oppdateringen som ikke er kompatible med nettbrettet. Dermed er den helt ubrukbar. P친 telefonen (ogs친 Android) fungerer den fint."
5,Silje Bj칮lseth Amundsen,"February 10, 2019",1,"F친r ikke opp nyheter etter 6. februar, og f친r stadig feilmelding om at sesjonen min er utl칮pt og at jeg m친 logge inn p친 nytt."
6,Kari Mazigh,"February 23, 2019",1,"Umulig app. M친 laste ned annenhver dag fordi f친r stadig melding om at jeg har lest 6 gratis artikler, og oppfordring om 친 bli abonnent - til tross for at jeg er abonnent og innlogget. Nytter ikke 친 logge av og p친 igjen heller. Kun 친 laste ned app'en p친 nytt. Sv칝rt misforn칮yd, og null hjelp fra Aften...Full Review"
7,Helen Virgo,"March 6, 2019",2,"F친r ikke tilgang til forsiden av Aftenposten p친 Android nettbrett pga info om ny app. Denne appen gjelder kun apple brukere men f칮rer til at jeg ogs친 utestenges. Kommer en fix p친 dette snart? Jeg ser at dette er fikset. Det er fint, men n친 er det ikke mulig 친 logge seg inn p친 nettbrettet."
8,Christian Schj칮lberg,"January 3, 2019",2,Mottar alt for mange varsler etter at telefonen ble oppdatert til Android pie. Ofte varsler jeg har sett f칮r som er opp til flere dager gamle
9,A Google user,"June 28, 2018",4,Hva med en daglig offline seksjon. D친rlig dekning p친 toget:) Ellers bra.
10,Patricia Zemer,"May 11, 2018",3,"Ikke en spesielt bra app. Lite mulighet for personalisering og samtidigvis 
mange un칮dvendige funksjoner. Er ikke vits i 친 lese Aftenposten hver dag 
siden mange av de gamle nyhetene forblir p친 ""forsiden"" og det er n칝rmest 
umulig 친 finne enkelt frem til nytt stoff eller finne frem til gammelt men 
...Full Review"
11,Arnulf Heimsbakk,"April 9, 2018",2,游 Har autoavspilling av video i nettsiden. Ikke forbrukervennlig n친r det kommer til mobil databruk. Ingen funksjon for 친 sl친 det av enn친.
12,Stian Havstein,"April 8, 2018",3,"Funker ok. Videoer starter sjelden og det er ikke mulig 친 scrolle i appen n친r man scroller p친 direktebloggen.  Oppdatering etter oppdateringen :) : Scrolling i direktebloggen er n친 ok, flott. Liten bug der enn친; media vises ikke i direktebloggen og det vises et sort panel med en snurrende sirkel der...Full Review"
13,Stein-Otto Svorst칮l,"March 28, 2018",4,"Helt 친lreit, men den er treg med 친 gjenkjenne at jeg er innlogget n친r jeg starter den. Ofte er tilbake - knappen ganske treg ogs친. Ellers savner jeg 친 kunne lese Aftenposten som e-avis, og 친 kunne lese Aftenposten Innsikt."
14,Lars Solli,"March 8, 2018",5,Sport Live linken virker ikke lengre. Kommer bare inn p친 side med sportssaker. Android 8.1
15,Ole Morten R칮nning,"March 4, 2018",5,Siste oppdatering took den ut av sirupskrukka. N친 친pnes artikler umiddelbart. (note8)
16,Per Kristian Helland,"March 5, 2018",4,Er det mulig 친 finne Aftenpostens lederartikkel i appen?
17,Ole Markus With,"December 17, 2017",2,"Brukte denne appen for nyhetsvarsel, men det har sluttet helt 친 fungere. For 친 lese selve avisa er fortsatt nettsida veldig mye bedre. Og hvorfor insisterer appen 친 친pne ting i Chrome og ikke i standard nettleser?"
18,Tormod Strand,"December 13, 2017",2,Fremdeles problemer med widget for Android 8.0. ingen mulighet for 친 oppfriske widget og den viser dermed gamle nyheter
19,Espen Christer Ness Endal,"November 4, 2017",2,Appen viser reklame selv om man har betalt abonnement. Double dipping kalles det. Har sagt opp abonnementet og kommer ikke tilbake f칮r reklamen er borte.
20,Kayhan Ozalp,"November 20, 2017",1,"Denne appen har sluttet 친 fungere normalt. N친r jeg klikker p친 en artikkel p친 forsiden f친r jeg en blank side mesteparten av tiden. Jeg venter lenge i h친p om at artikkelen skal lastes, men ingen ting skjer. G친r tilbake og pr칮ver p친 nytt med samme resultat. Bruker jeg en nettleser p친 telefonen i steden...Full Review"
21,Olav Vinje Nybakken,"December 11, 2017",2,"Treg, d친rlig brukergrensesnitt og irriterende varsling inne i appen. Aftenposten har mye bra innhold s친 merkelig at de ikke bruker litt mer ressurser p친 친 presentere det p친 en skikkelig m친te"
22,Helge Smeby,"October 27, 2017",3,"Litt utdatert, st칮tter ikke p친logging med FB / Google og reklame vises selv om en har kj칮pt abbonement. Gir ikke mulighet til 친 ikke legge inn vurdering."
23,Torleif Sm친back,"October 27, 2017",4,Funker fjell og jeg f친r servert nyheter dagen lang. G친r helt greit 친 logge inn. Irriterende med all reklamen n친r man faktisk betaler for 친 slippe.
24,Christian Kl칝bo,"December 7, 2017",1,"Gang p친 gang p친 gang p친 gang m친 jeg starte appen p친 nytt, fordi den viser den f칮rste artikkelen jeg klikker meg inn p친, men p친 den neste artikkelen ser jeg kun en tom side. Grunn nok til 친 si opp abonnementet ogs친 for meg.   Selvf칮lgelig viser de reklame ogs친 n친r man har abonnement, det er tross alt...Full Review"
25,Milos Alvirovic,"November 13, 2017",4,"Grei app, men noen enkelte ganger klarer ikke den 친pne artikler."
26,Henrik Torget,"November 8, 2017",5,A man's not hot.
27,H친vard Geithus,"October 17, 2017",2,Betaler 200 kroner i m친neden men fremdeles full av reklameannonser.
28,Maria Morland,"October 7, 2017",3,Have to re log in all the time.
29,Marius Wangberg,"December 14, 2017",3,No
30,A Google user,"August 4, 2017",3,"God leseropplevelse, men opplever noen irriterende situasjoner der jeg blir bedt om 친 logge inn selv om jeg betaler for abonnement, der back-knappen ikke virker og linker ikke virker."
31,A Google user,"August 7, 2017",4,"Ok m친te 친 lese Aftenposten p친, ikke helt funnet kjempemange argumenter for appen vs. nett."
32,Paul Spee,"August 16, 2017",5,Very good news app
33,Justin Baer,"August 26, 2017",5,Love it
34,Robotrobbie,"June 25, 2017",1,No changelog for permission change
35,Seif Zakaria,"July 4, 2017",5,"Working probably, feels smooth :)"
36,Marcus Lauritsen,"February 19, 2017",4,En del enkle designgrep kunne gjort appen mye bedre. Alt i alt en grei opplevelse.
37,Sigmund Slang,"February 2, 2017",1,"Hvis man betaler 200,- i m친neden er appen kjempebra, men det er en saftig pris 친 betale. Hvis man har gratisversjonen kan man kun lese 6 artikler i UKA, noe som er alt for lite....  Da blir det VG eller Dagbladet p친 meg.  Edit: Betaler man ville jeg kalt appen for 4 stjerner fordi jeg savner mulighe...Full Review"
38,Rolf Dagnes,"March 23, 2017",4,Good coverage of norwegian and international  news
39,Jan Philip Oeyen,"March 22, 2017",5,Love it. Needs tabs though
40,Klas Gj칮lmesli,"December 24, 2016",3,Vanskelig 친 registrere seg for 친 bli abonnent. Mange bilder blir ikke vist/oppdatert. Link til nyhetsvarsler ender ofte i en blank side. Samsung Galaxy S7. Ellers en glimrende nyhetsformidler.
41,Andr칠 Einhaug,"January 6, 2017",5,Rask til 친 laste inn alt innhold! God oversikt og lett 친 bruke
42,Markus S칝tran,"November 18, 2016",3,For mange nyhetsvarsler og ikke mulig 친 filtrere
43,Kriomos Kriokrio,"November 29, 2016",5,Bare greit.
44,Daniel Bj칬rkman,"November 5, 2016",2,"Galaxy note 3, android 5"
45,Gary McGinley,"November 7, 2016",3,"Litt clickbait, ellers greit"
46,Julius Mikkelsen,"November 6, 2016",4,Okay
47,Ian .M,"August 30, 2016",5,I'm finding this very helpful while learning the language
48,Mogens Nielsen,"June 28, 2016",5,Har ikke hatt noen problemer med app-en
49,Anna Anna,"July 28, 2016",1,Noen andre som opplever det?
50,Gro Lunde,"May 4, 2016",5,Veldig bra!
51,Lars Lund,"July 18, 2016",4,Bra app og ikke minst en avis som ser ut til 친 st친 st칮tt i forhold til flere andre
52,Ingvild Lundanes,"March 19, 2016",2,"N친 har det etterhvert blitt flere artikler som ikke vises, enn de som gj칮r det. F친r kun blanke sider p친 sv칝rt mange av artiklene. Innloggingsystemet er heller ikke veldig godt, det glemmer at jeg er innlogget (ogs친 p친 nett, ikke bare i appen) eller s친 p친st친r det at det ikke er noe abonnement p친 kont...Full Review"
53,Levent Ultanur,"March 22, 2016",3,Veldig bra design... men det er en bug som gj칮r det at den hopper p친 toppen av siden mens jeg leser... s친 mp jeg skrolle ned flere ganger for 친 lese ferdig en artikkel. Og aaalt for mange reklamer.
54,Martin Heyerdahl-Simonsen,"April 4, 2016",2,"Fungerer rett og slett bare bedre 친 친pne nettsiden deres i nettleseren i stedet. Navigasjon henger litt, blir ikke ordentlig full skjerm i aftenposten tv + litt i overkant med varsler."
55,BRG,"March 10, 2016",5,"Etter siste oppdatering gikk appen fra 친 v칝re nesten ubrukelig, til 친 funke. Fortsett med oppdateringene!"
56,Eike Kristian,"February 23, 2016",5,"I use this app to stay informed about Norwegian politics and Learn the Norwegian language, so I can hopefully study in Norway in two years."
57,Sten Kristian Finckenhagen,"February 19, 2016",1,"Sjelden har jeg opplevd en mer ustabil app enn denne. Den krasjer regelmessig, klarer ikke 친 huske meg som innlogget bruker og serverer ofte en gr친 skjerm fremfor 친 vise innholdet av en valgt artikkel. At noen skulle v칝re interessert i 친 betale kr 300 pr. mnd. for et s친 d친rlig produkt er ubegripelig...Full Review"
58,Kristian Robertsen,"January 28, 2016",5,"Fortsatt en bra app p친 5.1 (Lollipop,) rask, ser bra ut, men l친ser seg en liten gang iblant. Synes dere gj칮r en god jobb. En ting jeg har 친 klage p친 er notifikasjonene, n친r de ekspanderes f친r man bilde, men teksten er fortsatt kuttet (den fulle teksten er mer interessant.)"
59,Even Jahr,"December 27, 2015",4,Liker spesielt Osloby
60,Lasse Jansen,"January 5, 2016",5,Bra!
61,Martin E M,"November 3, 2015",5,AftenP 4eva xoxo
62,Robert Schmidt-Cisternas,"October 13, 2015",4,"Noks친 likt nettleser, p친 godt og vondt. Men fint om det blir mulig 친 fjerne ""dele/like""-knappene 칮verst p친 venstre side og nederst til h칮yre. P친 min skjerm dekker de alltid en del av artikkelen, jeg vil heller dele fra menyen."
63,nyagekosh,"October 6, 2015",4,Very briefing
64,Tor Magnus,"September 23, 2015",3,"Jeg er forn칮yd med utforming og hastighet, men som abonnent, hvorfor blir jeg utsatt for reklamer og forslag om 친 bli abonnent? Da kan jeg jo like gjerne lese avisen i nettleser med adblock."
65,Runa Trones,"September 19, 2015",5,Veldig forn칮yd med Aftenposten-appen!
66,Trond Hus칮,"August 29, 2015",3,Etter siste oppgradering er den blitt litt ustabil.
67,Joe LaCasce,"September 3, 2015",4,Very good news app.
68,칒yvind Husum,"July 5, 2015",1,Siste versjon viser ofte blank side istedenfor artikkel p친 min Samsung S3.
69,Raymond Marino Jonassen,"July 21, 2015",5,Enkel og grei fin app :)
70,A Google user,"May 29, 2015",5,Well designed. Easy to navigate
71,A Google user,"May 11, 2015",2,Articles are stacked on top of each other do its impossible see what the article is about without opening the article.
72,Lars Gustavsen,"May 11, 2015",3,"N칝rmer seg :) Spaltene er n친 i orden, men oppdatering av skjermbildet lenge etter at siden er lastet inn er fremdeles et problem."
73,칒ivind,"May 20, 2015",4,"Bra app n친! Reklamen er likevel irriterende plassert, og nye artikler blir ikke pre-loadet. Men alt i alt s친 er appen stabil og fungerer som tenkt. En stor forbedring! Klaget p친 animasjonene ogs친, men de var visst i den andre AP-appen :)"
74,Jeevesh Mishra,"May 12, 2015",5,Veldig bra!!
75,Marte Okkelmo,"April 19, 2015",1,Etter siste oppdatering f친r jeg ikke installert appen. F친r bare beskjed om at appen ikke er kompatibel. Selvsagt s친 ble gammel versjon fjernet under oppdateringen.
76,Ivar Farmen,"April 8, 2015",4,"Funker bra, men fortsetter 친 laste ned slik at skjermbildet hopper oppover I starten."
77,Gunnar Florus,"April 2, 2015",5,S칝rdeles rask feilretting. Imponerende
78,Gabor Tamas Dobos,"March 21, 2015",5,Super!
79,Simon Berdal,"February 4, 2015",3,"Denne appen kunne v칝rt s친 mye, mye bedre. Opplever ofte at det er referanser til andre artikler / eksterne kilder som man ikke kan klikke p친. Dessuten er den treg, og gir ikke mulighet for 친 lagre artikler man liker. Noe jeg ogs친 savner er en slags ""pack & go "" funksjonalitet, som gj칮r det mulig 친 s...Full Review"
80,Fredrik Arnesen,"January 20, 2015",3,"Fremdeles litt ustabil og noe treg, innholdet er bra."
81,Viggo Holger-Jensen,"January 11, 2015",5,Men hvorfor tar ikke push-notification-beskjedene meg til selve artikkelen? Hvorfor m친 jeg scrolle gjennom hele forsiden for 친 finne den?
82,Marius J칮rgensen,"January 16, 2015",3,Helt p친 trynet at det er x antall gratis dager. Ellers er det en av de beste nyhetsappene.
83,Indi Zone,"December 8, 2014",4,"Bra design osv, men den henger seg hele tiden n친r jeg blar rundt. (Siden stopper, men jeg fortsatt bruke side menyen osv) og fortsatt ingen fullskjerm video."
84,Bj칮rn N,"December 8, 2014",1,Ubrukelig. Henger seg opp hele tiden! M친 inn i appmanager for 친 lukke den f칮r den fungerer igjen..i noen f친 minutter. Etter den siste oppdateringen og 200 liter kaffe fungerer den fremdeles ikke!!
85,Bj칮rn B,"November 17, 2014",2,"Oppdatering: samme problem, men hoppingen gj칮r seg ferdig mye kjappere enn tidligere. Mindre irriterende har det blitt, det er faktisk mulig 친 bruke appen n친 hvis man gir den ett par sekunder f칮r man begynner 친 scrolle. Stor forbedring...    ""Lasting av reklamen f칮rer til at det hopper tilbake til t...Full Review"
86,Kristoffer Blix,"November 1, 2014",5,Er ikke hver dag man ser en app bygd s친 godt for KitKat!
87,Joar Tverberg,"October 3, 2014",2,"Den evig repeterende lasting av de tre millioner annonser og reklamer gj칮r at sidene til stadighet hopper opp til toppen igjen. En har valget mellom frustrert scrolling ned til punktet man ble avbrutt i, eller 친 legge fra seg mobilen i fem minutter til alt forstyrrende m칮kk er ferdig lastet. Dette p...Full Review"
88,A Google user,"October 2, 2014",3,"Litt treig, litt rotete."
89,A Google user,"June 30, 2014",2,Bare tekst og hvit skjerm.  Styr unna. Hver gang. Pr칮ver 친 resette cashe. Pr칮vde p친 chrome og m친 refreshe en del ganger til jeg f친r fram bilde osv.
90,Mike Schuh,"June 27, 2014",4,Quite good but not awesome. I read Aftenposten from Seattle.
91,gofor alvin,"June 2, 2014",4,Like what i said.
92,Ingrid Winther 칒ysleb칮,"April 11, 2014",2,Etter oppdateringen har den blitt treg og hopper ofte til toppen av siden. Ikke et produkt jeg ville betalt for.
93,Frank K,"April 21, 2014",3,"Heilt  alright, bra paa oppdateringer men det hender at det stopper  opp  noen ganger."
94,Morten C. Eike,"March 29, 2014",2,"Sider er neddynget med blinkende reklame (칝rlig talt, 6 reklamer p친 en liten nyhetssak?) som gj칮r de tunge 친 laste og f친r de til 친 hoppe opp og ned f칮r de er ferdig lastet. Bedre i vanlig nettleser, selv om antall reklamer er det samme."
95,Richard Foss,"March 29, 2014",5,"Gode funksjoner som flyter i god moderne android design.   Varslene er ogs친 gode, da de ikke er plagsomme. Viktige saker kommer opp, ikke reklame og ordin칝re hendelser."
96,John Peter Brekke,"March 21, 2014",4,"Ser grei ut, men hakkete scrolling og d친rlig respons. Forel칮pig er nettsiden bedre."
97,John Morten Malerbakken,"February 23, 2014",2,De foskjellige sideelementene8 leses og formatteres i vilk친rlig rekkef칮lge. Resultatet er at tekster og bilder fyker rundt til alt er lastet. Ikke bra.
98,Lars Fosdal,"March 4, 2014",1,Reklamen ser ut til 친 m친tte ta skylden. Av og til tar det lang tid f칮r en side lastes. Som et gulp fra gamle web tider.
99,Cosmo 82,"February 19, 2014",4,Den er bra:)
100,Preston Landers,"February 3, 2014",4,Love the content and love that the app follows many of the Android design guidelines.  Navigation is confusing when there are stacked navigation menus.
101,Harald Zahl,"January 23, 2014",5,"Ap dekker innenriks- og utenriksnyheter bedre enn noen annen norsk avis. Kunne ha 칮nsket meg mer problematiserende daglig journalistikk,  men dette gj칮re i st칮rre temaartikler."
102,Morten Byom,"December 22, 2013",3,Om du har lyst til 친 lese Aftenposten med reklame er dette appen for deg
103,A Google user,"January 16, 2014",1,Pay for news? No thanks!
104,gloria rodriguez,"December 29, 2013",5,It works beautifully with my Android.
105,Lars Joten Tangen,"December 7, 2013",1,Appen g친r ikke an 친 친pne. Betaler ikke for abonnement s친 lenge appen er ubrukelig.
106,Nisar Bashir,"December 10, 2013",1,Veldig treg! Widget har feil lenker
107,Hugo Birkelund,"November 30, 2013",4,"Works splendid on my htc one.  And the editorial profile fits the design.  Please, continue to keep the nonsense news out of AP. Do not mind paying for quality."
108,Kai Myrbakk,"November 30, 2013",2,"L친ser seg ofte og annonsene flytter seg slik at man m친 scrolle opp hele tiden for 친 lese artikler. Veldig irriterende, velger ofte andre medier for nyheter n친r dette skjer."
109,Frode Leirvik,"November 28, 2013",4,Denne er s친 bra at man glemmer det bare er mulig 친 lese Aftenposten med den. Her er det mye 친 l칝re for andre! Full score n친r video plug in fungerer som den skal.
110,A Google user,"November 26, 2013",2,"Meningsl칮st 친 ikke bruke native code p친 en slik app, selve forsiden er bare en nettside embeded i appen."
111,Sigrid Andersen Syverud,"November 30, 2013",4,Jeg liker konseptet med nyhetsvarselet... men det hadde v칝rt bedre om vi kunne egendefinerte hva som er en viktig nyhet. Med n칮kkelord eller noe?
112,A Google user,"December 1, 2013",5,"Rask, enkel og innbydende."
113,Alexander,"November 26, 2013",3,"Designet virker flatt og inviterer ikke noe s칝rlig til 친 bla videre i de forskjellige seksjonene. Skulle gj칝rne hatt et mer helhetlig design, se til de st칮rre mediehusene i europa hvordan de har l칮st dette. Guardian f.eks eller faktisk Ria Novosti."
114,Jan-Erik Sanne,"November 24, 2013",3,"""Nye"" Aftenposten kj칮rer betydelig tregere enn tidligere versjoner. F친r h친pe at betal-utgaven er bedre."
115,Arild Br칝kke,"November 24, 2013",5,Et s칝rdeles godt alternativ til tabloidsuppa!
116,shambhu shaw,"November 22, 2013",5,Excellent
117,Per Helge Aasland,"November 7, 2013",4,"God avis, ok app"
118,Axel Barco Baron,"November 25, 2013",2,Sykelig ustabil
119,A Google user,"January 9, 2014",2,"Var tynt i starten, men n친 kommer det seg :-)"
120,Helene Leet,"October 31, 2013",1,Keeps crashing
121,Tolleif Onarheim,"August 1, 2013",3,"videoer fungerer kun under Videofanen, aldri n친r de ligger i artikler. p친 xperia tablet z har siste oppdatering fjernet landscape view. annonsene p친 h칮yre del av siden er speilvendt. Mulig feilen ikke er I appen."
122,Den muterte dritt grisen! xD,"August 16, 2013",3,"Klikker for mange ganger, ellers er den en fin app."
123,Ange Michael MANIONGUI NGOMA,"July 6, 2013",3,"Videoer vises ikke, bare lyd. Brukergrensesnitt er ok. Knapper p친 bildesliden kan tenkes som video. Den trenger fiksing"
124,Lily Hansen,"May 28, 2013",2,"Jeg venter fortsatt p친 at de skal fikse appen s친 jeg faktisk kan f친 lese artiklene uten 친 m친tte pr칮ve flere ganger. Hos meg fryses bildet 칮verst i artikkelen, og jeg f친r ikke scrollet nedover. Eller forsidebildet vokser og vokser s친 resten av artikkelen hopper nedover. Det er veldig irriterende, vet...Full Review"
125,Kjetil E,"May 5, 2013",2,"Til tross for god WiFi-deknig, laster sidene ekstremt langsomt. Forsiden er for bred for skjermbredden til en Transformer-Pad, og aplikasjonen kr칝sjer omtrent hver gang jeg bruker den."
126,Simon Shaw,"March 12, 2013",4,Four stars again after crashing stopped.
127,Glenn Markussen,"February 15, 2013",2,"Ser ut til at den siste versjonen har fikset krasj ved 친pning av notifications, men n친 tryner den ved scrolling p친 forsiden veldig ofte..."
128,Nils Olve Gillund,"February 17, 2013",1,Telefonen l친ser seg heletiden.
129,A Google user,"November 16, 2012",1,"Hadde litt glede av denne appen ens stund p친 min Nexus 7 tablet, men etter at jeg fikk oppdatert Android til 4.2 fungerer den ikke lenger. Krasjer ved oppstart. Fungerer fint p친 HTC S telefonen."
130,Jon Trygve Olsen,"January 14, 2013",1,Appen krasjer konstant p친 min Galaxy Tab 2. Slik jeg har forst친tt det s친 er det fordi appen ikke er kompatibel med nyeste versjon av Android. Fiks problemet!
131,Huda Adan,"June 1, 2013",5,"Oversiktlig, enkel 친 bruke og stabil. Anbefaler denne appen p친 det sterkeste!"
132,Christian Str칮no,"January 17, 2013",5,Utrolig bra app sammenlignet med dag og vg som ikke tar deg tilbake til siden du var p친. Er du halvveis ned p친 sidrn tar denne deg tilbake der du var n친r du har lest en side. Ingen andre store tabloidavisene gj칮r dette.
133,Rune S,"December 27, 2012",1,Kr칝sjer pa nexus 7 med android 4.2
134,Christopher Thorjussen,"December 28, 2012",2,Fc
135,A Google user,"August 9, 2012",1,"Won't even start  Kr칝sjer p친 oppstart, er det et problem med Jelly Bean eller nexus 7?"
136,A Google user,"July 1, 2012",1,Samsung Galaxy Tab 2 7.0
137,A Google user,"July 13, 2012",1,Starter ikke en gang
138,A Google user,"May 4, 2012",4,Zoom funksjon mangler. Det som gj칮r nettsidene bedre
139,A Google user,"December 28, 2011",1,"Nettleseren p친 mobilen laster sidene ca. 14 ganger raskere. Rett og slett ubrukelig. Skjermtaster som tar altfor mye ned trekker ytterligere ned (om mulig). Hallo, vi har en menytast p친 android-telefoner..."
140,A Google user,"January 14, 2012",1,"Dritt! Gode nyheter, men scroller seg til toppen hele tiden. Android 4"
141,A Google user,"April 26, 2011",1,Amat칮rmessig. Ingen fingerscrolling. Fungerer p친 helt annen m친te enn p친 iPad. Ser ut som egen browser til websidene deres istedenfor ordentlig app.
142,A Google user,"February 13, 2011",2,Rotete. Zoom med fingrene virker ikke. Forstyrrende zoom-knapper over artiklene og forstyrrende menyknapper i bunn. D친rligere enn normal A-nettside.
143,A Google user,"March 21, 2011",3,Strukne bilder om en ikke zoomer s친 langt ut at ikke kan lese teksten.. Fint med tilgangen til siste videoer.
144,A Google user,"March 16, 2011",3,"Bildene er strukket ut i h칮yden p친 Nexus One, slitsomt 친 lese.."
145,A Google user,"February 4, 2011",1,S친 treg at den er ubrukelig.
146,A Google user,"February 11, 2011",4,Fantastisk p친 Galaxy Tab
147,A Google user,"March 25, 2012",3,"iPhone versjonen er mye raskere enn denne, burde fikses"
148,A Google user,"February 1, 2011",1,DRM p친 appendix - teit. Bildene blir dratt. Trenger en god del jobb.
149,A Google user,"January 25, 2011",2,dette er jo bare tull. savner den opprinnelige appen p친 iphone. Den viser sakene enkelt og greit. dette er jo bare nettsiden men mye tregere
150,A Google user,"January 26, 2011",1,Lite eller ingen ekstra verdi utover websidene. Kan ikke installeres p친 SD! Fail!
151,A Google user,"January 21, 2011",1,Lite responsiv og forcecloser p친 Nexus S. Bildene er ogs친 veldig dratt i h칮yden.
152,A Google user,"January 29, 2011",3,Helt grei. H친per p친 oppdateringer for 친 gj칮re appen bedre. 5 stjerner etter noen forbedringer.
153,A Google user,"January 28, 2011",3,Bedre 친 bruke den vanlige browseren.
154,Arild Arsheim,"November 25, 2013",1,"""Unfortunately aftenposten has stopped"" er beskjeden jeg f친r hver gang jeg i det hele tatt pr칮ver 친 친pne denne appen. Jeg har restartet tlf. avinstallert og reinstallert til ingen nytte."
155,Arul Narendran,"November 25, 2013",1,Rett etter p친logging crashet appen. Lettere 친 lese p친 nettleseren. Sony Xperia
156,Rudolf Blostrupmoen,"October 23, 2013",5,Endelig en oppdatering det smaker fugl av. Litt mer speed n친 s친 begynner det 친 hjelpe!
157,Magnus Breder Birkenes,"August 9, 2018",1,"Ustabil, stadige utlogginger, d친rlig navigasjon. Dette er ikke bra nok i 
2018."
158,Roar G,"December 25, 2013",2,Begrenset antall artikler per m친ned
159,A Google user,"July 26, 2012",4,Bunker for meg
