,Date,Review_Score,Review_Text
1,"March 26, 2019",2,"kind of all right, but it is impossible to see if a news item is video or text - and as video often starts up with sound on, this app is next to useless for me. i need to be able to control sound."
2,"July 7, 2019",5,"hadde v칝rt fint om dere kunne ha lagt til m칮rkt tema i appen, ellers helt topp 游녨"
3,"May 27, 2019",5,"veldig bra, fint at nrk kom med en ordentlig applikasjon"
4,"May 27, 2019",5,helt utmerket. har ventet lenge p친 en nrk app
5,"May 7, 2019",4,dere m친 f친 darkmode
6,"July 31, 2019",5,great app
7,"March 4, 2019",5,helt konge! skulle bare hatt darkmode...
8,"August 10, 2018",4,"appen er fin, men jeg savner mulighet til 친 skreddersy hva slags nyheter 
jeg f친r varsler om."
9,"September 29, 2018",5,"funker, dog kunne tenkt meg pinch to zoom i nettleseren og valg av kategorier for nyhetsvarsel."
10,"February 11, 2018",2,"installerte denne prim칝rt for 친 f친 varsel om viktige nyheter/hendelser, men verken trond giske eller ol er noe jeg f칮ler er viktig nok til 친 bli varslet om. det burde v칝re et valg for nyheter som vanligvis f칮rer til ekstrasending, resten f친r jeg med meg p친 vanlig m친te."
11,"March 16, 2018",4,"det eneste jeg savner er 친 kunne endre ""notification"" lyden til appen. det hadde v칝rt veldig greit 친 kunne h칮re att det er nrk appen jeg f친r melding fra. en nattmodus med m칮rkere farger hadde ogs친 v칝rt et stort pluss."
12,"March 1, 2018",4,great way to practice learning norwegian :-)
13,"November 11, 2017",1,"it doesn't show the news page properly on my note 8, it flashes and then shows a blank screen."
14,"September 16, 2017",2,appen liker ikke vpn.
15,"August 27, 2017",1,forrige versjon var langt bedre. horisontal scrolling for siste nyhetsinnslag fungerer ikke. hvordan kan jeg g친 tilbake til forrige versjon?
16,"December 1, 2018",5,"godt design, bra funksjonalitet"
17,"August 7, 2017",3,"helt 친lreit app, men greier ikke helt 친 se vitsen med den n친r jeg like greit kan sjekke nettsidene. om jeg kunne ha bestemt selv hva slags saker som kom opp p친 forsida kunne det v칝rt et poeng for meg , 친 ha kategoriene jeg er interessert i samlet p친 ei egen side er ikke det samme.  liker at jeg kan ...full review"
18,"July 29, 2017",3,grei app for gratis nyheter. savner s칮kefunksjon for 친 finne konkrete saker.
19,"June 28, 2017",1,"denne appen er fullstendig ubrukelig. ingen horisontal modus, ingen beslektede saker. idiotiske deleknapper p친 forsiden. hvorfor dele noe du ikke har lest enda? horisontal rulling av nyheter, hva har dere r칮yke egentlig?  dette er fortsatt for d친rlig."
20,"January 5, 2018",3,hvor ble det av s칮keknappen?
21,"May 19, 2017",5,flott! ingen klager om appen.
22,"April 7, 2017",5,im happy with it. good j8b!
23,"March 14, 2017",1,"verre og verst! foer var den burkbar paa en maate, men naa, huff huff"
24,"March 1, 2017",1,innstillinger blir ikke lagra. kan ikke s칮ke. avinstalleres.
25,"February 22, 2017",1,please make it possible to zoom.
26,"February 6, 2017",2,utrolig treg til 친 laste ned sidene.  ui er god.  hadde v칝rt genialt om radio og tv var integrert.
27,"December 22, 2016",5,"veldig bra design og utforming av navigering og artikler. kjapp og resposiv. m친tte ta omstart p친 mobilen for 친 f친 appen til 친 fungere, til tross for gjentatte avinstalleringer og installeringer."
28,"December 8, 2016",2,"present version of app is worse than previous. clean layout: yes, easy access to news and articles :  no."
29,"December 5, 2016",3,i would like to turn off vibration for notifications. and get no notifications during the night.
30,"November 12, 2016",1,"den nye er tungvint og uoversiktelig. buggete og treg. som et glansbilde, fint p친 fremsiden men ingenting bak."
31,"August 17, 2015",3,"bra app, men litt utdatert ui? blir noen ganger l친st til et zoom-niv친 uten 친 klare 친 zoome ut n친r man g친r fra landskap til portrett p친 hjem-siden. fikses n친r jeg trykker p친 en artikkel og s친 g친r tilbake igjen til hjemmesiden."
32,"April 15, 2015",4,"super app, men er litt synd at ein ikkje kan g친 direkte inn p친 tittelen som kjem opp som notifications p친 telefonen (g친r inn p친 forsida). elles str친lande n칮gd! :)"
33,"May 22, 2015",1,appen henger seg ofte opp s친 jeg m친 lukke den og 친pne p친 nytt igjen. spesielt n친r den har v칝rt 친pen en stund. radio fungerer sv칝rt d친rlig. beklager nrk. jeg hadde forventet mer av dere. skal ikke nrk v칝re en riks kringkaster tilgjengelig p친 alle plattformer?
34,"February 14, 2015",2,cannot search with keyboard [jbak and hacker's]
35,"January 15, 2014",3,hvis appen legges i bakrunnen blir nyhetsiden blank. da m친 jeg avslutte og begynne p친 nytt.
36,"October 3, 2013",5,topp
37,"August 17, 2013",2,"som den forrige nrk radio-appen hopper avspillingen fram og tilbake, rene flettverket. sv칝rt ofte hopper avspillingen helt ut, og du m친 starte programmet p친 nytt. fint med tilgang til programmene, med musikk under streaming, men hva hjelper det n친r musikk og prat stokkes uavlatelig?"
38,"July 2, 2013",1,fungerer ikke p친 samsung galaxy s4 etter siste oppdatering
39,"June 25, 2013",1,disconnecter  hele tiden.
40,"June 21, 2013",1,denne appen var meget bra helt til n친. n친 spiller radio bare noen sekunder s친 stopper det. s친 ikke poenget med 친 forandre p친 noe som allerede funket
41,"May 13, 2013",2,"nei og nei, wow...den nye versjonen med nrk tv er jo stupid, programmet sporer av og du m친 starte alt p친 nytt hele tiden. ikke rart lisenspengene sl칮ses bort n친r man skj칮nner hvor mangelfullt tankesettet er. forrige versjon: appen hacker, bilde og lyd ikke sync,  og stopper opp etter en stund. nei, ...full review"
42,"June 9, 2013",1,if nrk paid for this they should ask for the money back.
43,"April 12, 2013",5,fungerer helt fint p친 min nexus 4. bare installer mx player s친 vil det fungere absolutt fantastisk!
44,"May 1, 2013",1,fungerer ikke 친 spille av tv. ingen grunn til installere denne appen. hvorfor tvang dere utv. av nrk appen til 친 fjerne dem!.
45,"March 23, 2013",1,jeg forventer bedre av nrk
46,"January 31, 2013",2,"etter siste update, som skulle fikse krash problemer. opplever jeg mye mer krasj."
47,"February 9, 2013",1,"de fleste vil se tvnyheter eller direktesending. ellevilt mye klikking f칮r man er i m친l - i en ekstern app! elendig streaming, hvorfor ikke like bra eller bedre enn taaengs  ex-app?"
48,"February 15, 2013",1,"lyden stopper etter noen minutter, s친 begynner den forfra igjen og s친 d칮r den."
49,"January 2, 2013",1,"testet pa htc decire, galaxy tab 10.1 og s2. elendig videokvalitet, masse bugs, utnytter store skjermer elendig, laster tregt, m친 oppdateres manuelt mellom klippene - for 친 nevne noe. elendig sammenlikned med taaeng sin app som var enkel men faktisk funket (dere vet hvem jeg mener). eneste positive ...full review"
50,"November 30, 2012",1,dere har lagt inn eit program for streaming med flash p친 ein plattform som ikkje st칮tter flash! ta eit hint og lag noe som vi kan bruke!
51,"December 29, 2012",1,"denne appen har et ekstremt lite intuitivt brukergrensesnitt (gui) i tillegg til at den ikke fungerer til en av kjernefunksjonene: til 친 se nett-tv p친 mobilen. choppy og glitchy bilde, samt henger seg med jevne mellomrom.   anbefaler utviklerne 친 sette seg bedre inn i android sin designfilosofi."
52,"January 17, 2013",1,"ehh...  dersom jeg vil se alt dere har p친 nettsidene, s친 har jeg nettleser p친 telefonen.  en app b칮r v칝re mer spesialisert.  pr칮vde denne for 친 se p친 tv, men bare hakking og d친rlig bilde.  skjerp dere.  ubrukelig app for tv titting, og nesten ubrukelig for radio, da den tar lange pauser (jeg har bra...full review"
53,"November 19, 2013",2,it doesnt link with the nrk tv app when its supposed to. it just tells me im not connected to the internet when i clearly am connected.
54,"January 5, 2013",2,"synes egentlig appen er grei, men det som trekker mye ned er at man ikke kan streame videoklippene som er lagt ut pga. at de er flash-baserte."
55,"November 10, 2012",3,"appen funker ok, men kan ikke spille av videoer siden de krever flash og flash er fjernet fra google play. kj칮rer android 4.0.4."
56,"November 26, 2012",4,"i f칮lge ratingen p친 playstore skulle man tro at dette er en s칮ppel-app. men det er det ikke, fungerer faktisk ganske s친 bra."
57,"January 17, 2013",1,synes appen ser bra ut og er praktisk oppbygd. problemet er at den ikke funker i fullskjerm og at lyden av og til begynner 친 sprake noe forferdelig. kj칮rer appen p친 samsung note 10.1. jeg skal straks kaste p친 minst tre stjerner til om det kommer en oppdatering som fikser disse problemene.
58,"January 13, 2013",1,"app chrashes when trying to open ""nett tv"". uses flash!"
59,"December 18, 2012",5,a very good app. app release issues are gone. 12 dec 2012.
60,"January 1, 2013",5,"har pr칮vd 친 se nrk ved 친 bruke chrome eller dolphin browser, men fungerer relativt d친rlig. med denne appen fungerer alt utmerket, skj칮nner ikke helt den d친rlige ratingen."
61,"January 29, 2013",5,fungerer helt fint
62,"January 3, 2013",5,fungerer ypperlig p친 nexus 10. enklere brukergrensesnitt enn p친 nettsiden.  enig med flere andre som ikke forst친r hvorfor appen har f친tt s친 d친rlig rating.
63,"January 15, 2013",5,"etter 친 ha testet appen, m친 eg si at score'n er urettferdig. den f친r helt klart 5 av meg, skj칮nt eg ble litt overrasket over at nrk skulle klare 친 lage noe bra... godt jobbet nrk!"
64,"November 25, 2012",1,"fungerer jo knapt! elendig navigering, s칮k fungerer ikke... forventer mye bedre av en institusjon jeg betaler 2500 til i 친ret! det finnes knapt et positivt review her, p친 tide dere tar kundene deres alvorlig og f친r fikset denne appen!"
65,"November 14, 2012",1,the previous app was simpler and better. why complicate things?
66,"December 19, 2012",5,fungerer veldig bra. tilgang til alt nrk har p친 nett direkte fra appen.
67,"November 27, 2012",1,denne fungerer jo faktisk ikke... kreve flash for avspilling p친 android nettbrett???!
68,"November 14, 2012",1,"denne updaten er ikke bra,alt crasher og video streamingen hopper 친 hakker, fix it or **** it"
69,"January 29, 2013",1,nrk er jo bare skjit uansett..
70,"January 16, 2013",1,det er pinlig 친 se nrks fors칮k p친 nettkringkasting.
71,"December 12, 2012",4,funker som fjell her. bra video kvalitet 친. :)
72,"December 10, 2012",5,this app is fixed now. tv works and looks fantastic on the galaxy note 10.1
73,"September 10, 2012",2,h칮r med nrkbeta folka. om appen. de har litt peil :)  og s친 kan dere bruke ca posisjon (nettverk) istedenfor gps.
74,"November 11, 2012",1,"kan dere vennligst lage en streaming-app som fungerer? med nye nett -tv ekskluderte dere seere med treg pc, og p친 android gj칮r dere det samme (selv om det fantes gode apper laget av andre...). med hilsen noks친 rasende kunde. --lg optimus one"
75,"October 22, 2012",1,forrige appen kunne man bruke til 친 se nett tv. med denne fungerer ikke nett tv lenger. den henger seg opp og fungerer utrolig d친rlig! kjempe frustrerende.
76,"October 1, 2012",1,kan ikke finne denne p친 samsung galaxt tab 2 10.1 !! finner appen p친 sony xperia active og p친 nett.. synd at man ikke f친r brukt den p친 et nettbrett!!!!
77,"October 2, 2012",1,"tester appen regelmessig p친 min htc one v, men den har aldri fungert. kr칝sjer f칮r oppstart. savner den uoffisielle appen for nrk nett-tv."
78,"November 4, 2012",1,"dette er f칮rste gangen jeg f칮ler behov for 친 rate en gratis app. man forventer i utgangspunktet ikke et veldig godt produkt for ingenting. men denne appen er rent faktisk i s칝rklasse ubrukelig. den er full av bugs, den har et generisk og uegnet grensesnitt (ser ut som websiden til nrk), den er ikke ...full review"
79,"October 22, 2012",1,opprinnelig trodde jeg at dette ville bli bra. men det ble det ikke. denne appen har s친 mange problemer at jeg undrer meg over at nrk har sluppet et s친 lite testet produkt ut p친 app-markedet. skuffende d친rlig!
80,"November 1, 2012",1,skjer ingenting n친r jeg trykker p친 tvprogrammer eller direkte tv.
81,"November 8, 2012",1,"den mener jeg ikke har flash, jeg kj칮rer android"
82,"November 9, 2012",5,stream og navigering er veldig bra.
83,"September 8, 2012",1,since you shut down the unofficial app you're only getting one star. alternatives are always good for development and innovation.
84,"September 8, 2012",1,dette er jo bare en d친rlig nettleser. det trenger jeg ikke.
85,"September 10, 2012",1,f친r bare beskjed om at nrk ikke har rettigheter til 친 vise programmene p친 mobile enheter. bra bruk av lisens pengene v친re...
86,"September 9, 2012",1,"appen kommer helt tiden opp med beskjed om at jeg m친 v칝re koblet til internett selv om jeg faktisk er det, og jeg ser at den laster nettsiden rett f칮r beskjeden kommer opp. ogs친 d친rlig med oppdateringer."
87,"September 7, 2012",1,does nothing an ordinary web browser can't do. video doesn't show for live transmits.
88,"December 10, 2012",1,"dette er s친nn passe d친rlig. flaks om du f친r sett tv. den klager hele tiden at den ikke har nett b친de via wlan og telenor, selv om alle andre internet apper funker. probably worst app ever..."
89,"August 15, 2012",3,"usynkronisert, ufattelig d친rlig og kornete bilde kvalitet. det var bedre kvalitet p친 den uoffisielle appen som ble stengt ned. fiks dette og det blir en super duper bra app :)"
90,"August 7, 2012",1,den uoffisielle appen var mange ganger bedre. det hakker og sliter seg gjennom. og det p친 min 100 mbit linje...
91,"August 26, 2012",1,"horribelt av statskanalen med sin sterke pengest칮tte i form av statlig hjelp og lisenspenger inn fra forbrukeren 친 ikke kunne utvikle en mer fullverdig app, og samtidig nekte sending fra denne andre uoffisielle nrk appen. denne funker jo ikke. svart skjerm over 10min testing og n친r lyden kommer ""hen...full review"
92,"August 13, 2012",1,og dette brukes lisenspengene til! som jeg ikke betaler uansett... ;p
93,"August 12, 2012",1,dette var ikke brukbar.
94,"July 18, 2012",1,"den uoffisielle appen som dere tok livet av fungerte fint. denne skiten gir hakkete b친de lyd og bilde p친 min viewpad 7 uansett nettforbindelse. istedenfor 친 ta livet av en utmerket gratis app, burde dere ansette utvikleren som f친r til det dere ikke kan."
95,"August 10, 2012",2,"appen pr칮ver 친 tilby alt p친 ett sted, noe som for s친 vidt er prisverdig, men ender opp med 친 bli alt for stor og treg. den konkurrerende nrk avspiller gjorde en mye bedre jobb!"
96,"July 29, 2012",1,savner nrk tv appen. noen som vet hvor man kan f친 tak i .apk til den gamle appen?
97,"August 12, 2012",1,kan ikke forst친 at dere tok livet av en uoffisiell gratisversjon og gir oss dette alternativet. fungerer d친rlig og oppleves kronglete.
98,"July 26, 2012",1,jeg trenger ikke enda en nettleser... kun en god steaming tjeneste.
99,"August 7, 2012",1,fremdeles elendig etter siste oppdatering. video og lyd hakker...
100,"August 9, 2012",1,nrk har klart 친 lage en app som er helt ubrukelig. gratulerer.
101,"August 6, 2012",1,"helt krise. bare s칮ppel. krasjer konstant, elendig video, treig. forkastelig app."
102,"August 6, 2012",1,"uoversiktlig, hakkete bilde og lyd. den andre appen var langt bedre."
103,"July 17, 2012",1,dere sperrer en glimrende klient for 친 se nett-tv og mener tydeligvis at dette er et bra alternativ? crappy frontend til nett sidene deres... skuffende!
104,"July 11, 2012",1,dere fjernet en app som fungerte...og jeg fikk denne som krever 친 f친 vite min n칮yaktige gps-posisjon samt lyd- og bildeopptak...og i tillegg er ustabil. hurra...
105,"July 9, 2012",1,"kindly explain to someone who's $550 shorter after paying for a galaxy 10.1 why you're pushing ""android"" apps when the video isn't supported on the tablet?"
106,"July 8, 2012",1,"poscast krasjer, live stream gir sort skjerm - men kommer til gjengjeld tilbake 'en gang' i bakgrunnen... dette er langt fra noe jeg ville brukt mine lisenspenger p친..."
107,"July 17, 2012",3,f친r bare svart skjerm
108,"July 7, 2012",1,"snarvei til en webside hvor det tar 친r, dag og votter f칮r ting reagerer. svart skjerm store deler, og missync mellom lyd og bilde n친r de f칮rst kom opp sammen."
109,"July 6, 2012",1,takk for at dere erstatter en app som funker med en som ikke virker i det hele tatt. skattepenger well spent... >:[
110,"July 4, 2012",1,denna funker jo ikke 친 se nett tv med.
111,"July 5, 2012",1,virker ikke :( null stjerner.
112,"May 19, 2012",2,"dette er jo bare en middelm친dig browser som viser m.nrk.no.  jeg var kanskje noe naiv, men jeg hadde virkelig ventet meg noe bedre. jeg skj칮nner ikke vitsen."
113,"July 5, 2012",5,denne appen virker perfekt. digger den. b-)
114,"May 24, 2012",1,kr칝sjer ved oppstart. motorola defy+
115,"May 28, 2012",1,virker ikke
116,"May 18, 2012",2,"er glad for at nrk bryr seg om oss android-folk! gleder meg til 친 gi denne en god anmeldelse, men f칮r jeg kan gj칮re det s친 m친 en ting fikses: appen lar skjermen skru seg av. da forsvinner litt av vitsen med mobil tv-mulighet.  med en gang dere fikser screen timeout s친 tror jeg jeg blir veldig forn칮y...full review"
117,"October 15, 2012",1,"kanskje ikke overraskende, men dette er sjeldent d친rlig! fascinerende arrogant bruk av lisensmidler."
118,"November 12, 2012",4,"skj칮nner ikke hva folk klager over i forhold til denne? fungerer helt str친lende p친 min asus tf300, android 4.1. man kunne kanskje vurdert 친 skille ut selve nyhetstjenesten fra nrks eget innhold?"
119,"July 9, 2012",2,"hva er vitsen? treg og ute av synk. hadde ventet meg noe bedre for lisenspengene. h친per de klarer 친 f친 til noe bedre med tiden, men kommer ikke til 친 holde pusten i p친vent av det."
120,"August 9, 2012",1,"anbefaler dere 친 leie inn noen som har peiling til utviklingen av appene deres. den uoffisielle appen var b친de mer intuitiv og funksjonell. elendig streaming, ubrukelig app, stygg taktikk mot konkurrenten."
121,"November 24, 2012",1,"har det g친tt nrk hus forbi at android ikke lenger st칮tter flash? jeg er kun interessert i tv-biten. web-innhold leser jeg i min foretrukne webleser, takk."
122,"July 28, 2012",1,"f칮rst krever dere at gratis alternativet fjernes, f칮rste dere legger ut en ""app"" der lyd og bilde har s친 d친rlig kvalitet at man ikke kan se p친 det. kringkasting til folket? lag iallefall noe som fungerer f칮r dere legger det ut og fjerner alternativene"
123,"December 9, 2012",5,at den skulle kreve flash er bare t칮ys. kj칮ret칮y 4.1.2 og opplever ingen problemer med 친 se direkte tv/ videoer.
124,"August 10, 2012",1,"radio funker bra, men tv-delen er ubrukelig. hakker og d친rlig kvalitet uansett nettverk. den uoffisielle var 100%"
125,"March 1, 2013",1,"fikk beskjed om at jeg manglet flash p친 min ""maskin"". jeg vil bare streame nrk nett-tv!"
126,"July 11, 2012",1,"video krasjer, men lyden fortsetter i bakgrunnen - m친 tvangsstenges for 친 stoppe.  hvorfor mase om jeg vil ha pushet p친 meg lokalnytt? uendelig mye bortkastet plass og h친pl칮s navigering i menyene. les ux-guiden for gb/hc->ics eller se f.eks. facebook/spotify."
127,"January 7, 2013",5,var skeptisk til denne n친r jeg s친 at det var en snarvei. men det gj칮r ingenting n친r nettsiden er s친 godt gjennomf칮rt.
128,"March 24, 2013",5,"s3 stahp bitchin, works like a charm."
129,"December 2, 2012",2,"de siste versjonene av android mangler flash, nett-tv fungerer ikke i disse. hvorfor ikke legge seg p친 samme l칮sning som for iphone/ipad?"
130,"July 11, 2012",2,"savner flytende design, s친 appen kan tilpasse seg forskjellige skjermst칮rrelser og orienteringer(f.eks. mobiltelefon og nettbrett). savner grensesnitt mot g+."
131,"July 13, 2012",1,"p친 iphone er det egen netttv-app, som ved ett klikk umiddelbart starter valgt kanal. her er det tre klikk, via nettsidene til nrk, f칮r jeg blir sittende 친 se p친 en svart skjerm som sier ""laster, vennligst vent"""
132,"November 2, 2012",1,ingen videoer vil spille av p친 min transformer prime (4.1.1.). vil jeg surfe internett gj칮r jeg selvsagt d i en nettleser. ubrukelig app.
133,"November 20, 2012",1,hvorfor nrk bruker teknologi som er avlegs? alle videoklipp er flash basert. nrk burde l칝re av svenske svt. ingenting fungerer p친 android tablet eller telefoner m nrk app eller via deres hjemmesider. android st칮tter ikke flash etter v.4.0. vi kan heller ikke dette vente p친 html5 i evigheter.  irrita...full review
134,"December 4, 2012",5,virket helt uten problemer. jeg 친pner videoene i diceplayer. alt har v칝rt helt smertefritt!
135,"November 12, 2012",1,som for mac og linux ogs친... og det fantes allerede en app som gjorde jobben..
136,"June 18, 2018",1,"helt forferdelig app. veldig dumt av nrk 친 ha byttet appen til n친v칝rende 
versjon."
137,"February 10, 2013",1,"unstable, crashes on all notifications"
138,"December 28, 2012",1,lar meg se 2 min. om gangen f칮r den dropper
139,"September 9, 2012",1,"det var en gang en app som faktisk funka, hadde den p친 mobilen min. men s친 ble den pluttselig forbudt, og han som hadde laget den m친tte stenge den. synd egentlig, synes at kvalitet er forbudt i dag. men h친per at kanskje nrk kan hyre ham til 친 lage en bedre utgave, og s친 relansere den. da tror jeg de...full review"
140,"February 17, 2013",1,fungerer ikke for direkte nrk tv som den stengte appen gjorde
141,"December 16, 2012",1,virker ikke paa min galaxy fordi den ikke har stoette for flash
142,"July 25, 2012",1,"h친pl칮st , h친ndter e r ikke bilder. 친pner heller en nettleser"
143,"July 28, 2012",1,den uoffisielle appen var 20x bedre
144,"November 18, 2012",1,latterlig.
145,"January 30, 2013",1,doesn't work!
146,"December 19, 2012",4,funker ser det ut til.
147,"January 3, 2017",3,jeg liker nrk
148,"August 3, 2012",5,"this new software is a massive improvement, compared to the previous software. big thumbs up ."
149,"February 14, 2015",5,vet ikke!
150,"August 9, 2012",1,dritapp. virker ikke.
151,"July 2, 2015",5,cool
152,"August 14, 2015",5,great
