,Name,Date,Review_Score,Review_Text
1,Joe Supererogatory,"March 26, 2019",2,"Kind of all right, but it is impossible to see if a news item is video or text - and as video often starts up with sound on, this app is next to useless for me. I need to be able to control sound."
2,Vemund Wannag,"July 7, 2019",5,"Hadde v칝rt fint om dere kunne ha lagt til m칮rkt tema i appen, ellers helt topp 游녨"
3,Mathias Pedersen,"May 27, 2019",5,"veldig bra, fint at NRK kom med en ordentlig applikasjon"
4,Simon Helgen,"May 27, 2019",5,helt utmerket. har ventet lenge p친 en nrk app
5,Patchie Patch,"May 7, 2019",4,dere m친 f친 darkmode
6,Ernst Th칛lmann,"July 31, 2019",5,great app
7,Bj칮rn-Tore semb,"March 4, 2019",5,helt konge! skulle bare hatt darkmode...
8,Marius Elvheim,"August 10, 2018",4,"Appen er fin, men jeg savner mulighet til 친 skreddersy hva slags nyheter 
jeg f친r varsler om."
9,A Google user,"September 29, 2018",5,"Funker, dog kunne tenkt meg pinch to zoom i nettleseren og valg av kategorier for nyhetsvarsel."
10,A Google user,"February 11, 2018",2,"Installerte denne prim칝rt for 친 f친 varsel om viktige nyheter/hendelser, men verken Trond Giske eller OL er noe jeg f칮ler er viktig nok til 친 bli varslet om. Det burde v칝re et valg for nyheter som vanligvis f칮rer til ekstrasending, resten f친r jeg med meg p친 vanlig m친te."
11,Tordemann,"March 16, 2018",4,"Det eneste jeg savner er 친 kunne endre ""notification"" lyden til appen. Det hadde v칝rt veldig greit 친 kunne h칮re att det er NRK appen jeg f친r melding fra. En nattmodus med m칮rkere farger hadde ogs친 v칝rt et stort pluss."
12,Jonathan Evason,"March 1, 2018",4,Great way to practice learning Norwegian :-)
13,A Google user,"November 11, 2017",1,"It doesn't show the news page properly on my Note 8, it flashes and then shows a blank screen."
14,Alexander,"September 16, 2017",2,Appen liker ikke VPN.
15,Sten Kristian Finckenhagen,"August 27, 2017",1,Forrige versjon var langt bedre. Horisontal scrolling for siste nyhetsinnslag fungerer ikke. Hvordan kan jeg g친 tilbake til forrige versjon?
16,Kjetil Rydland,"December 1, 2018",5,"Godt design, bra funksjonalitet"
17,Maye,"August 7, 2017",3,"Helt 친lreit app, men greier ikke helt 친 se vitsen med den n친r jeg like greit kan sjekke nettsidene. Om jeg kunne ha bestemt selv hva slags saker som kom opp p친 forsida kunne det v칝rt et poeng for meg , 친 ha kategoriene jeg er interessert i samlet p친 ei egen side er ikke det samme.  Liker at jeg kan ...Full Review"
18,H친kon Schanke,"July 29, 2017",3,Grei app for gratis nyheter. Savner s칮kefunksjon for 친 finne konkrete saker.
19,Lars Fosdal,"June 28, 2017",1,"Denne appen er fullstendig ubrukelig. Ingen horisontal modus, ingen beslektede saker. Idiotiske deleknapper p친 forsiden. Hvorfor dele noe du ikke har lest enda? Horisontal rulling av nyheter, hva har dere r칮yke egentlig?  Dette er fortsatt for d친rlig."
20,Ruben Nicolai Johnsen Birkelund,"January 5, 2018",3,Hvor ble det av s칮keknappen?
21,Utkarsh Singh,"May 19, 2017",5,Flott! Ingen klager om appen.
22,Alexander Sooksri Henriksen,"April 7, 2017",5,Im happy with it. Good j8b!
23,Jogeir Lindseth,"March 14, 2017",1,"Verre og verst! Foer var den burkbar paa en maate, men naa, huff huff"
24,Christoffer Larson,"March 1, 2017",1,Innstillinger blir ikke lagra. Kan ikke s칮ke. Avinstalleres.
25,Jon Arne Huseb칮,"February 22, 2017",1,Please make it possible to zoom.
26,Sharedvalueafrica South Africa,"February 6, 2017",2,Utrolig treg til 친 laste ned sidene.  UI er god.  Hadde v칝rt genialt om radio og tv var integrert.
27,Ari August Segebarth-Bjerga,"December 22, 2016",5,"Veldig bra design og utforming av navigering og artikler. Kjapp og resposiv. M친tte ta omstart p친 mobilen for 친 f친 appen til 친 fungere, til tross for gjentatte avinstalleringer og installeringer."
28,Anthony Brown,"December 8, 2016",2,"Present version of app is worse than previous. Clean layout: yes, easy access to News and articles :  no."
29,Mikhail Schedrin,"December 5, 2016",3,I would like to turn off vibration for notifications. And get no notifications during the night.
30,Kjell Hansen,"November 12, 2016",1,"Den nye er tungvint og uoversiktelig. Buggete og treg. Som et glansbilde, fint p친 fremsiden men ingenting bak."
31,Henrik .B,"August 17, 2015",3,"Bra app, men litt utdatert UI? Blir noen ganger l친st til et zoom-niv친 uten 친 klare 친 zoome ut n친r man g친r fra landskap til portrett p친 hjem-siden. Fikses n친r jeg trykker p친 en artikkel og s친 g친r tilbake igjen til hjemmesiden."
32,ammi,"April 15, 2015",4,"Super app, men er litt synd at ein ikkje kan g친 direkte inn p친 tittelen som kjem opp som notifications p친 telefonen (g친r inn p친 forsida). Elles str친lande n칮gd! :)"
33,Gerhard Just Olsen,"May 22, 2015",1,Appen henger seg ofte opp s친 jeg m친 lukke den og 친pne p친 nytt igjen. Spesielt n친r den har v칝rt 친pen en stund. Radio fungerer sv칝rt d친rlig. Beklager NRK. Jeg hadde forventet mer av dere. Skal ikke NRK v칝re en riks kringkaster tilgjengelig p친 alle plattformer?
34,arielle hunter,"February 14, 2015",2,Cannot search with keyboard [Jbak and Hacker's]
35,John Bjerke,"January 15, 2014",3,Hvis appen legges i bakrunnen blir nyhetsiden blank. Da m친 jeg avslutte og begynne p친 nytt.
36,Karen Karn,"October 3, 2013",5,Topp
37,Dag Rune Gjellesvik,"August 17, 2013",2,"Som den forrige nrk radio-appen hopper avspillingen fram og tilbake, rene flettverket. Sv칝rt ofte hopper avspillingen helt ut, og du m친 starte programmet p친 nytt. Fint med tilgang til programmene, med musikk under streaming, men hva hjelper det n친r musikk og prat stokkes uavlatelig?"
38,Kristin Omre Raknes,"July 2, 2013",1,Fungerer ikke p친 Samsung Galaxy S4 etter siste oppdatering
39,Geir N친dland,"June 25, 2013",1,Disconnecter  hele tiden.
40,Kevin Fossum,"June 21, 2013",1,Denne appen var meget bra helt til n친. N친 spiller radio bare noen sekunder s친 stopper det. S친 ikke poenget med 친 forandre p친 noe som allerede funket
41,Per Hansen,"May 13, 2013",2,"nei og nei, wow...den nye versjonen med NRK TV er jo stupid, programmet sporer av og du m친 starte alt p친 nytt hele tiden. Ikke rart lisenspengene sl칮ses bort n친r man skj칮nner hvor mangelfullt tankesettet er. Forrige versjon: appen hacker, bilde og lyd ikke sync,  og stopper opp etter en stund. Nei, ...Full Review"
42,Tor Helgesen,"June 9, 2013",1,If nrk paid for this they should ask for the money back.
43,John Patrick Glattetre,"April 12, 2013",5,Fungerer helt fint p친 min Nexus 4. Bare installer MX Player s친 vil det fungere absolutt fantastisk!
44,Robert K,"May 1, 2013",1,Fungerer ikke 친 spille av tv. Ingen grunn til installere denne appen. Hvorfor tvang dere utv. av nrk appen til 친 fjerne dem!.
45,Ludvig Pedersen,"March 23, 2013",1,Jeg forventer bedre av NRK
46,Rune Kolvik,"January 31, 2013",2,"Etter siste update, som skulle fikse krash problemer. Opplever jeg mye mer krasj."
47,Yann Aker,"February 9, 2013",1,"De fleste vil se TVnyheter eller direktesending. Ellevilt mye klikking f칮r man er i m친l - i en ekstern app! Elendig streaming, hvorfor ikke like bra eller bedre enn Taaengs  ex-app?"
48,Andreas Wiik,"February 15, 2013",1,"Lyden stopper etter noen minutter, s친 begynner den forfra igjen og s친 d칮r den."
49,A Google user,"January 2, 2013",1,"Testet pa HTC decire, Galaxy tab 10.1 og S2. Elendig videokvalitet, masse bugs, utnytter store skjermer elendig, laster tregt, m친 oppdateres manuelt mellom klippene - for 친 nevne noe. Elendig sammenlikned med Taaeng sin app som var enkel men faktisk funket (dere vet hvem jeg mener). Eneste positive ...Full Review"
50,Odne Helleb칮,"November 30, 2012",1,Dere har lagt inn eit program for streaming med flash p친 ein plattform som ikkje st칮tter flash! Ta eit hint og lag noe som vi kan bruke!
51,Bj칮rn Krogh Robak,"December 29, 2012",1,"Denne appen har et ekstremt lite intuitivt brukergrensesnitt (GUI) i tillegg til at den ikke fungerer til en av kjernefunksjonene: til 친 se nett-TV p친 mobilen. Choppy og glitchy bilde, samt henger seg med jevne mellomrom.   Anbefaler utviklerne 친 sette seg bedre inn i Android sin designfilosofi."
52,A Google user,"January 17, 2013",1,"Ehh...  Dersom jeg vil se alt dere har p친 nettsidene, s친 har jeg nettleser p친 telefonen.  En app b칮r v칝re mer spesialisert.  Pr칮vde denne for 친 se p친 TV, men bare hakking og d친rlig bilde.  Skjerp dere.  Ubrukelig app for TV titting, og nesten ubrukelig for radio, da den tar lange pauser (jeg har bra...Full Review"
53,Kim Kaspersen,"November 19, 2013",2,It doesnt link with the nrk tv app when its supposed to. It just tells me Im not connected to the internet when I clearly am connected.
54,Magnus Johan Nilsen,"January 5, 2013",2,"Synes egentlig appen er grei, men det som trekker MYE ned er at man ikke kan streame videoklippene som er lagt ut pga. At de er flash-baserte."
55,A Google user,"November 10, 2012",3,"Appen funker ok, men kan ikke spille av videoer siden de krever flash og flash er fjernet fra Google Play. Kj칮rer Android 4.0.4."
56,A Google user,"November 26, 2012",4,"I f칮lge ratingen p친 playstore skulle man tro at dette er en s칮ppel-app. Men det er det ikke, fungerer faktisk ganske s친 bra."
57,Paul See,"January 17, 2013",1,Synes appen ser bra ut og er praktisk oppbygd. Problemet er at den ikke funker i fullskjerm og at lyden av og til begynner 친 sprake noe forferdelig. Kj칮rer appen p친 Samsung Note 10.1. Jeg skal straks kaste p친 minst tre stjerner til om det kommer en oppdatering som fikser disse problemene.
58,A Google user,"January 13, 2013",1,"App chrashes when trying to open ""nett tv"". Uses flash!"
59,John Sure,"December 18, 2012",5,A very good app. App release issues are gone. 12 Dec 2012.
60,Roger S칝le,"January 1, 2013",5,"Har pr칮vd 친 se NRK ved 친 bruke Chrome eller Dolphin Browser, men fungerer relativt d친rlig. Med denne appen fungerer alt utmerket, skj칮nner ikke helt den d친rlige ratingen."
61,Frode B.,"January 29, 2013",5,Fungerer helt fint
62,Christian Meum,"January 3, 2013",5,Fungerer ypperlig p친 Nexus 10. Enklere brukergrensesnitt enn p친 nettsiden.  Enig med flere andre som ikke forst친r hvorfor appen har f친tt s친 d친rlig rating.
63,Finn Alexander Lie,"January 15, 2013",5,"Etter 친 ha testet appen, m친 eg si at score'n er urettferdig. Den f친r helt klart 5 av meg, skj칮nt eg ble litt overrasket over at NRK skulle klare 친 lage noe bra... Godt jobbet NRK!"
64,A Google user,"November 25, 2012",1,"Fungerer jo knapt! elendig navigering, s칮k fungerer ikke... Forventer mye bedre av en institusjon jeg betaler 2500 til i 친ret! Det finnes knapt et positivt review her, p친 tide dere tar kundene deres alvorlig og f친r fikset denne appen!"
65,A Google user,"November 14, 2012",1,The previous app was simpler and better. Why complicate things?
66,Tor Eilev Kleiverud,"December 19, 2012",5,Fungerer veldig bra. Tilgang til alt NRK har p친 nett direkte fra appen.
67,CasualGard,"November 27, 2012",1,Denne fungerer jo faktisk ikke... Kreve flash for avspilling p친 Android nettbrett???!
68,A Google user,"November 14, 2012",1,"Denne updaten er ikke bra,alt crasher og video streamingen hopper 친 hakker, Fix it or **** it"
69,Trnod P,"January 29, 2013",1,nrk er jo bare skjit uansett..
70,A Google user,"January 16, 2013",1,Det er pinlig 친 se NRKs fors칮k p친 nettkringkasting.
71,A Google user,"December 12, 2012",4,Funker som fjell her. Bra video kvalitet 친. :)
72,A Google user,"December 10, 2012",5,This app is fixed now. Tv works and looks fantastic on the galaxy note 10.1
73,A Google user,"September 10, 2012",2,H칮r med Nrkbeta folka. Om appen. De har litt peil :)  Og s친 kan dere bruke ca posisjon (nettverk) istedenfor gps.
74,A Google user,"November 11, 2012",1,"Kan dere VENNLIGST lage en streaming-app som fungerer? Med nye nett -TV ekskluderte dere seere med treg PC, og p친 Android gj칮r dere det samme (selv om det FANTES gode apper laget av andre...). Med hilsen Noks친 Rasende Kunde. --LG Optimus One"
75,A Google user,"October 22, 2012",1,Forrige appen kunne man bruke til 친 se nett TV. Med denne fungerer ikke nett TV lenger. Den henger seg opp og fungerer utrolig d친rlig! Kjempe frustrerende.
76,A Google user,"October 1, 2012",1,Kan ikke finne denne p친 Samsung Galaxt tab 2 10.1 !! finner appen p친 Sony xperia active og p친 nett.. Synd at man ikke f친r brukt den p친 et nettbrett!!!!
77,A Google user,"October 2, 2012",1,"Tester appen regelmessig p친 min htc one v, men den har aldri fungert. Kr칝sjer f칮r oppstart. Savner den uoffisielle appen for nrk nett-tv."
78,A Google user,"November 4, 2012",1,"Dette er f칮rste gangen jeg f칮ler behov for 친 rate en gratis app. Man forventer i utgangspunktet ikke et veldig godt produkt for ingenting. Men denne appen er rent faktisk i s칝rklasse ubrukelig. Den er full av bugs, den har et generisk og uegnet grensesnitt (ser ut som websiden til NRK), den er ikke ...Full Review"
79,A Google user,"October 22, 2012",1,Opprinnelig trodde jeg at dette ville bli bra. Men det ble det ikke. Denne appen har s친 mange problemer at jeg undrer meg over at nrk har sluppet et s친 lite testet produkt ut p친 app-markedet. Skuffende d친rlig!
80,A Google user,"November 1, 2012",1,Skjer ingenting n친r jeg trykker p친 tvprogrammer eller direkte tv.
81,A Google user,"November 8, 2012",1,"Den mener jeg ikke har flash, jeg kj칮rer Android"
82,A Google user,"November 9, 2012",5,Stream og navigering er veldig bra.
83,A Google user,"September 8, 2012",1,Since you shut down the unofficial app you're only getting one star. Alternatives are always good for development and innovation.
84,A Google user,"September 8, 2012",1,Dette er jo bare en d친rlig nettleser. Det trenger jeg ikke.
85,A Google user,"September 10, 2012",1,F친r bare beskjed om at nrk ikke har rettigheter til 친 vise programmene p친 mobile enheter. Bra bruk av lisens pengene v친re...
86,A Google user,"September 9, 2012",1,"Appen kommer helt tiden opp med beskjed om at jeg m친 v칝re koblet til internett selv om jeg faktisk er det, og jeg ser at den laster nettsiden rett f칮r beskjeden kommer opp. Ogs친 d친rlig med oppdateringer."
87,A Google user,"September 7, 2012",1,Does nothing an ordinary web browser can't do. Video doesn't show for live transmits.
88,A Google user,"December 10, 2012",1,"Dette Er s친nn passe d친rlig. Flaks om du f친r sett Tv. Den klager hele tiden at den ikke har nett b친de via wlan og telenor, selv om alle andre internet apper funker. Probably worst app ever..."
89,A Google user,"August 15, 2012",3,"Usynkronisert, ufattelig d친rlig og kornete bilde kvalitet. Det var bedre kvalitet p친 den uoffisielle appen som ble stengt ned. Fiks dette og det blir en super duper bra app :)"
90,A Google user,"August 7, 2012",1,Den uoffisielle appen var mange ganger bedre. Det hakker og sliter seg gjennom. Og det p친 min 100 mbit linje...
91,A Google user,"August 26, 2012",1,"Horribelt av statskanalen med sin sterke pengest칮tte i form av statlig hjelp og lisenspenger inn fra forbrukeren 친 ikke kunne utvikle en mer fullverdig app, og samtidig nekte sending fra denne andre uoffisielle nrk appen. Denne funker jo ikke. Svart skjerm over 10min testing og n친r lyden kommer ""hen...Full Review"
92,A Google user,"August 13, 2012",1,Og dette brukes lisenspengene til! som jeg ikke betaler uansett... ;p
93,A Google user,"August 12, 2012",1,Dette var ikke brukbar.
94,A Google user,"July 18, 2012",1,"Den uoffisielle appen som dere tok livet av fungerte fint. Denne skiten gir hakkete b친de lyd og bilde p친 min Viewpad 7 uansett nettforbindelse. Istedenfor 친 ta livet av en utmerket gratis app, burde dere ansette utvikleren som f친r til det dere ikke kan."
95,A Google user,"August 10, 2012",2,"Appen pr칮ver 친 tilby alt p친 ett sted, noe som for s친 vidt er prisverdig, men ender opp med 친 bli alt for stor og treg. Den konkurrerende NRK avspiller gjorde en mye bedre jobb!"
96,A Google user,"July 29, 2012",1,Savner NRK TV appen. Noen som vet hvor man kan f친 tak i .apk til den gamle appen?
97,A Google user,"August 12, 2012",1,Kan ikke forst친 at dere tok livet av en uoffisiell gratisversjon og gir oss dette alternativet. Fungerer d친rlig og oppleves kronglete.
98,A Google user,"July 26, 2012",1,Jeg trenger ikke enda en nettleser... Kun en GOD steaming tjeneste.
99,A Google user,"August 7, 2012",1,Fremdeles elendig etter siste oppdatering. Video og lyd hakker...
100,A Google user,"August 9, 2012",1,Nrk har klart 친 lage en app som er helt ubrukelig. Gratulerer.
101,A Google user,"August 6, 2012",1,"Helt krise. Bare s칮ppel. Krasjer konstant, elendig video, treig. Forkastelig app."
102,A Google user,"August 6, 2012",1,"Uoversiktlig, hakkete bilde og lyd. Den andre appen var langt bedre."
103,A Google user,"July 17, 2012",1,Dere sperrer en glimrende klient for 친 se nett-tv og mener tydeligvis at dette er et bra alternativ? Crappy frontend til nett sidene deres... skuffende!
104,A Google user,"July 11, 2012",1,Dere fjernet en app som fungerte...og jeg fikk denne som krever 친 f친 vite min n칮yaktige gps-posisjon samt lyd- og bildeopptak...og i tillegg er ustabil. Hurra...
105,A Google user,"July 9, 2012",1,"Kindly explain to someone who's $550 shorter after paying for a Galaxy 10.1 why you're pushing ""android"" apps when the video isn't supported on the tablet?"
106,A Google user,"July 8, 2012",1,"Poscast krasjer, live stream gir sort skjerm - men kommer til gjengjeld tilbake 'en gang' i bakgrunnen... Dette er langt fra noe jeg ville brukt mine lisenspenger p친..."
107,A Google user,"July 17, 2012",3,F친r bare svart skjerm
108,A Google user,"July 7, 2012",1,"Snarvei til en webside hvor det tar 친r, dag og votter f칮r ting reagerer. Svart skjerm store deler, og missync mellom lyd og bilde n친r de f칮rst kom opp sammen."
109,A Google user,"July 6, 2012",1,Takk for at dere erstatter en app som funker med en som ikke virker i det hele tatt. Skattepenger well spent... >:[
110,A Google user,"July 4, 2012",1,Denna funker jo ikke 친 se nett tv med.
111,A Google user,"July 5, 2012",1,Virker ikke :( null stjerner.
112,A Google user,"May 19, 2012",2,"Dette er jo bare en middelm친dig browser som viser m.nrk.no.  Jeg var kanskje noe naiv, men jeg hadde virkelig ventet meg noe bedre. Jeg skj칮nner ikke vitsen."
113,A Google user,"July 5, 2012",5,Denne appen virker perfekt. Digger den. B-)
114,A Google user,"May 24, 2012",1,Kr칝sjer ved oppstart. Motorola Defy+
115,A Google user,"May 28, 2012",1,Virker ikke
116,A Google user,"May 18, 2012",2,"Er glad for at NRK bryr seg om oss Android-folk! Gleder meg til 친 gi denne en god anmeldelse, men f칮r jeg kan gj칮re det s친 m친 en ting fikses: appen lar skjermen skru seg av. Da forsvinner litt av vitsen med mobil TV-mulighet.  Med en gang dere fikser screen timeout s친 tror jeg jeg blir veldig forn칮y...Full Review"
117,A Google user,"October 15, 2012",1,"Kanskje ikke overraskende, men dette er sjeldent d친rlig! Fascinerende arrogant bruk av lisensmidler."
118,A Google user,"November 12, 2012",4,"Skj칮nner ikke hva folk klager over i forhold til denne? Fungerer helt str친lende p친 min Asus tf300, android 4.1. Man kunne kanskje vurdert 친 skille ut selve nyhetstjenesten fra NRKs eget innhold?"
119,A Google user,"July 9, 2012",2,"Hva er vitsen? Treg og ute av synk. Hadde ventet meg noe bedre for lisenspengene. H친per de klarer 친 f친 til noe bedre med tiden, men kommer ikke til 친 holde pusten i p친vent av det."
120,A Google user,"August 9, 2012",1,"Anbefaler dere 친 leie inn noen som har peiling til utviklingen av appene deres. Den uoffisielle appen var b친de mer intuitiv og funksjonell. Elendig streaming, ubrukelig app, stygg taktikk mot konkurrenten."
121,A Google user,"November 24, 2012",1,"Har det g친tt NRK hus forbi at Android ikke lenger st칮tter flash? Jeg er kun interessert I tv-biten. Web-innhold leser jeg i min foretrukne webleser, takk."
122,A Google user,"July 28, 2012",1,"F칮rst krever dere at gratis alternativet fjernes, f칮rste dere legger ut en ""app"" der lyd og bilde har s친 d친rlig kvalitet at man ikke kan se p친 det. Kringkasting til folket? Lag iallefall noe som fungerer f칮r dere legger det ut og fjerner alternativene"
123,Geir F칮rde,"December 9, 2012",5,At den skulle kreve flash er bare t칮ys. Kj칮ret칮y 4.1.2 og opplever ingen problemer med 친 se direkte tv/ videoer.
124,A Google user,"August 10, 2012",1,"Radio funker bra, men tv-delen er ubrukelig. Hakker og d친rlig kvalitet uansett nettverk. Den uoffisielle var 100%"
125,P친l Driveklepp,"March 1, 2013",1,"fikk beskjed om at jeg manglet flash p친 min ""maskin"". jeg vil bare streame nrk nett-tv!"
126,A Google user,"July 11, 2012",1,"Video krasjer, men lyden fortsetter i bakgrunnen - m친 tvangsstenges for 친 stoppe.  Hvorfor mase om jeg vil ha pushet p친 meg lokalnytt? Uendelig mye bortkastet plass og h친pl칮s navigering i menyene. Les UX-guiden for GB/HC->ICS eller se f.eks. Facebook/Spotify."
127,Anders Kirker칮d,"January 7, 2013",5,Var skeptisk til denne n친r jeg s친 at det var en snarvei. Men det gj칮r ingenting n친r nettsiden er s친 godt gjennomf칮rt.
128,Matias Kongsvik,"March 24, 2013",5,"S3 Stahp bitchin, works like a charm."
129,Morten C. Eike,"December 2, 2012",2,"De siste versjonene av Android mangler Flash, Nett-TV fungerer ikke i disse. Hvorfor ikke legge seg p친 samme l칮sning som for iPhone/iPad?"
130,A Google user,"July 11, 2012",2,"Savner flytende design, s친 appen kan tilpasse seg forskjellige skjermst칮rrelser og orienteringer(f.eks. mobiltelefon og nettbrett). Savner grensesnitt mot G+."
131,A Google user,"July 13, 2012",1,"P친 iPhone er det egen NettTV-app, som ved ett klikk umiddelbart starter valgt kanal. Her er det tre klikk, via nettsidene til NRK, f칮r jeg blir sittende 친 se p친 en svart skjerm som sier ""laster, vennligst vent"""
132,A Google user,"November 2, 2012",1,Ingen videoer vil spille av p친 min Transformer prime (4.1.1.). Vil jeg surfe internett gj칮r jeg selvsagt d i en nettleser. Ubrukelig app.
133,A Google user,"November 20, 2012",1,hvorfor nrk bruker teknologi som er avlegs? alle videoklipp er flash basert. Nrk burde l칝re av svenske svt. ingenting fungerer p친 android tablet eller telefoner m Nrk app eller via deres hjemmesider. android st칮tter ikke flash etter v.4.0. vi kan heller ikke dette vente p친 html5 i evigheter.  irrita...Full Review
134,Phuong Mai Trapnes,"December 4, 2012",5,Virket helt uten problemer. Jeg 친pner videoene i diceplayer. Alt har v칝rt helt smertefritt!
135,A Google user,"November 12, 2012",1,Som for mac og linux ogs친... Og det fantes allerede en app som gjorde jobben..
136,Gabriella Lee Schittny,"June 18, 2018",1,"Helt forferdelig app. Veldig dumt av NRK 친 ha byttet appen til n친v칝rende 
versjon."
137,Pernilla Edlund,"February 10, 2013",1,"Unstable, crashes on all notifications"
138,Kjell Magne G. Eines,"December 28, 2012",1,Lar meg se 2 min. om gangen f칮r den dropper
139,A Google user,"September 9, 2012",1,"Det var en gang en app som faktisk funka, hadde den p친 mobilen min. Men s친 ble den pluttselig forbudt, og han som hadde laget den m친tte stenge den. Synd egentlig, synes at kvalitet er forbudt i dag. Men h친per at kanskje NRK kan hyre ham til 친 lage en bedre utgave, og s친 relansere den. Da tror jeg de...Full Review"
140,Eirik Mistereggen,"February 17, 2013",1,Fungerer ikke for direkte NRK tv som den stengte appen gjorde
141,Nancy Smith,"December 16, 2012",1,Virker ikke paa min Galaxy fordi den ikke har stoette for Flash
142,A Google user,"July 25, 2012",1,"H친pl칮st , h친ndter e r ikke bilder. 칀pner heller en nettleser"
143,A Google user,"July 28, 2012",1,Den uoffisielle appen var 20x bedre
144,A Google user,"November 18, 2012",1,Latterlig.
145,Peter Jones,"January 30, 2013",1,Doesn't work!
146,A Google user,"December 19, 2012",4,Funker ser det ut til.
147,A Google user,"January 3, 2017",3,Jeg liker nrk
148,A Google user,"August 3, 2012",5,"This new software is a massive improvement, compared to the previous software. Big thumbs up ."
149,Thamir,"February 14, 2015",5,VET IKKE!
150,A Google user,"August 9, 2012",1,Dritapp. Virker ikke.
151,Navdeep Kaur,"July 2, 2015",5,Cool
152,Dhiraj kaushik,"August 14, 2015",5,Great
