,Date,Review_Score,Review_Text
192,"February 2, 2015",5,som det burde v칝re
193,"February 7, 2015",3,f친r ofte feilmelding n친r den 친pnes...
194,"February 9, 2015",3,bra
195,"January 22, 2015",5,enklere bli det ikke
196,"January 22, 2015",1,virker ikke i det helle tatt
197,"January 20, 2015",5,virker bra...nice jobb !!gs4+
198,"December 31, 2014",1,"fungerte bra f칮r, men etter oppgradering s친 vil den ikke lenger starte opp. sony xperia compact, android 4.4.4"
199,"January 17, 2015",1,crashes all the time! uninstalled og reinstalled 5 times. works for a few days then crashes!
200,"December 16, 2014",5,ingenting negativt 친 komme med
201,"January 8, 2015",1,funker ikke p친 motox. lolipop 5.0
202,"December 29, 2014",5,fantastisk skjit
203,"September 15, 2014",2,"designet for 친 holde p친 kundens oppmerksomhet lengst mulig, ikke for 친 gj칮re det som skal gj칮res s친 kjapt og enkelt som mulig. at dette er et slags framskritt er bare fordi forrige versjon var virkelig elendig.  kutt egenreklamen og iukk helt ved utlogging! 친 bruke halve skjermbildet p친 rekiame for ...full review"
204,"September 11, 2014",5,perfekt! ingen tungvindt m친te 친 logge inn i nettbanken p친 lengre! n친 kan regningen bli betalt p친 vei inn fra postkassen og hives i s칮ppelet f칮r jeg kommer inn d칮ren!
205,"September 13, 2014",4,"endelig fungerer appen med art, s친 n친 kan jeg faktisk bruke den. fungerer helt greit. rask og responsiv p친 min gs5."
206,"September 12, 2014",4,fortsatt litt sm친rusk med ui
207,"September 11, 2014",5,"sv칝rt brukervennlig, veldig bra skandiabanken!"
208,"September 10, 2014",5,very easy to use
209,"August 30, 2014",1,arkiveringen bare forsvinner etter 친 친 skrevet inn aktiveringskoden og navn p친 enheten. skuffene start. har pr칮vd flere ganger uten hell. h친per p친 snarlig oppdatering. htc one s eier.
210,"September 3, 2014",4,kommer til steget der jeg skal skrive inn nye app kode men appen bare stenger seg. n친r jeg skriver inn kode og n친r jeg trykker og. pr칮ver omstart av tlf.        etter omstart av tlf gikk aktiveringen bra :)
211,"August 21, 2014",1,"crasher umiddelbart etter start p친 android 4.1.2 med sony xperia s. gjelder b친de f칮rste nye versjon og ""fikset"" versjon."
212,"August 19, 2014",2,"meget laber ux. det er vanskelig 친 navigere og se hvilke felter som er relevante og hvor man b칮r trykke. det g친r ikke an 친 sveipe menyen inn fra siden, s친 du m친 rulle helt opp hver gang for 친 f친 inn menyen. for mange like elementer og rot. vanlig nettbank og mobilsiden er mye bedre. denne appen gj칮r...full review"
213,"August 21, 2014",5,godt 친 endelig ha en skikkelig app til banken! dette virker lovende. det lille jeg har brukt den forel칮pig har g친tt som en dr칮m.
214,"August 18, 2014",5,fantastisk support og respons fra skandiabanken! bug fikset p친 en dag!
215,"August 21, 2014",5,den nye oppdateringen l칮ser alle tidligere problemer. en fryd 친 bruke!
216,"August 30, 2014",2,foretrekker den forrige versjonen
217,"August 21, 2014",5,the best bank in norway
218,"August 13, 2014",1,"hva skjer med at det n친 kreves titalls tastetrykk for enkle oppgaver? hvorfor kan en ikke trykke 'tilbake' for 친 havne p친 foreg친ende side? forfallsregister stemmer ikke n친r en velger 'alle kontoer'. visuelt pent, men un칮dvendig rotete"
219,"August 15, 2014",4,"men oppf칮rte seg merkelig ved f칮rste innlogging etter registreringen var gjort. avsluttet bare flere ganger, s친 virket det som om den ville ha meg til 친 registrere p친 ny, men s친 oppf칮rte den srg plutselig bare normalt..."
220,"August 14, 2014",1,app crashes on startup on older version of android (4.1.1).
221,"August 17, 2014",1,"kun 3 tastetrykk etter aktivering, s친 ble det feil og omstart. jeg kommer tilbake om noen m친neder n친r app'en er ordentlig gjennomtestet."
222,"August 17, 2014",2,nedtur. tilf칮rer ingenting annet enn grafisk staffasje og at jeg n친 m친 huske enda et pin. navigasjon var lettere i forrige versjon
223,"August 17, 2014",5,fantastisk forbedring fra tidligere apper. utrolig enkel i bruk
224,"August 14, 2014",1,crashes at start on samsung galaxy s2
225,"August 14, 2014",4,liker den nye oppdateringen
226,"April 11, 2014",1,har avinstallert og reinstallert flere ganger men den virker ikke. n친r man ettersp칮r saldo eller overf칮ring av penger p친 sms.  f친r f칮lgende feilmelding: feil din enhet st칮tter ikke sending av sms.  bruker google hangouts funksjonen som sms p친 tlf.  appen er mobilbank versjon 2.2.1
227,"March 31, 2014",5,gj칮r akkurat det den skal.
228,"August 16, 2013",3,"look at the nordea app, it has 4 digit quick login function. if you fix that i will give you 5+ stars!"
229,"August 19, 2013",3,flott app men er skeptisk p친 hvorfor trenger dere tilgang til mmser og smser??
230,"June 22, 2018",2,bekreft opplysningene knapp funker ikke.
231,"March 1, 2012",1,"overf칮ring mellom konti funket f칮r, men n친 f친r jeg bare feilmeldinger og m친 installere appen p친 nytt. dette har vart i mer enn en uke. er det ingen som retter opp feil p친 denne appen?"
232,"May 11, 2012",3,"savner tilgang til e-fakturaer.. mulig jeg er ubrukelig, men ingen av valgene f칮rte meg dit."
233,"January 26, 2012",5,mobilbanken fungerer tilsynelatande veldig bra. alle viktige funksjonar til stade. har ikkje pr칮vd sms-bank.
234,"March 18, 2012",2,aksjehandelfunksjonen fungerer ikke lengere. den fungerte i den gamle versjonen. ganske irriterende. htc google nexus one.
235,"May 1, 2012",1,mildt sagt en elendig app. eller rettere sagt ubrukelig!
236,"April 4, 2012",3,"bra, men n친r kan efakturaer behandles???"
237,"July 7, 2011",1,"utrolig d친rlig, hadde ventet bedre av skandiabanken som ellers er helt topp. regner ikke dette som en ordentelig app, bare tr칮bbel. bruk heller web."
238,"December 5, 2011",1,en veldig d친rlig implementering... dette er rett og slett en nettleser som peker til mobilsidene. ikke har dere changelog heller.
239,"January 11, 2011",3,"fungerer bra, men ved login vhs sms burde app kunne lese den sms selv. kl칮nete 친 m친tte hoppe mellom sms og app for 친 taste koden."
240,"December 6, 2011",1,"denne fungerte mye bedre f칮r. og siden siste oppdatering har tilgang til 친 ringe og sende sms, avinstallerer jeg! web fungerer bedre!!"
241,"May 15, 2011",2,"visuelt sett helt greit, men utrolig tungvint 친 logge p친 med sms... bruker aldri denne appen pga d친rlig p친logging... dessverre..."
242,"February 1, 2011",4,"god app, men er det ikke mulig 친 integrere sms slik at jeg ikke trenger 친 fylle inn dette selv..."
243,"December 31, 2010",1,d친rlig bruksopplevelse. knappene er sm친 og det er vanskelig 친 bruke. d친rlig flyt i innloggings prosess. her b칮r skandiabanken redesinge hele appen
244,"December 15, 2010",3,"bra med enkel tilgang, men grensesnittet er ikke optimalisert for touch. for sm친 knapper og linker."
245,"October 7, 2012",1,dette er en trist app. skandiabanken er bedre tjent med 친 trekke appen fra google play.
246,"April 27, 2011",1,latterlig at appen restarter etter man prover aa hente kode fra sms
247,"December 17, 2010",4,ganske bra. gj칮r akkurat det man kan forvente.
248,"July 4, 2011",5,very userfriendly. has proved to be very useful several times for me.
249,"May 12, 2011",3,stusselig.
250,"March 30, 2012",1,"making a web page open when you push an icon is not an app. take the time to do something useful, like making a real app."
251,"February 4, 2015",1,"det var bra i starten, men i siste dagene er bare problemer. m친 installere p친 nytt flere ganger  per dag. vet ikke hvorfor er blitt s친nn.:("
252,"July 17, 2012",1,"pr칮vde nettopp appen for f칮rste gang, men den kr칝sjer hver eneste gang jeg fyller ut feltene ved betaling til ny betalingsmottaker. har logget meg p친 4 ganger p친 rad n친 og har fortsat ikke f친tt betalt en eneste regning - dette er bare irriterende sl칮sing med tid. avinstallert."
253,"July 5, 2018",1,"etter 친 ha utf칮rt en tjeneste er det nesten umulig 친 finne tilbake til 
oversikten (startsiden). fix dette s친 skal jeg gi appen 5"
254,"November 10, 2016",4,"appen begynner 친 bli skikkelig bra, men jeg blir fortsatt ofte logget ut og f친r meldingen ""appen m친 aktiveres p친 nytt"""
255,"June 28, 2015",1,helt utrolig d친rlig! eneste app p친 nexus6 som kan stanse telefonen med en reaksjonstid som g친r over flere sekunder ved feks tastetrykk og valg av inputfelter. nesten s친 man skulle tro at telefonen var kontrollert av andre... tidligere versjon p친 andre telefoner har fungert. fiks dette!
256,"June 29, 2015",1,"har ikke rootet eller modifisert telefon, men kan fortsatt ikke bruke appen pga. feilmelding."
257,"June 13, 2015",1,ikke mulig 친 skrive inn tlf og f칮dselsdato p친 bank id innlogging. ubrukelig.
258,"March 14, 2015",3,fungerer dersom jeg ikke er tilkoplet wifi...
259,"April 28, 2012",5,thank you skandia ;)
260,"June 28, 2015",1,trenger root
261,"April 24, 2018",5,excellent bank app.
