,Date,Review_Score,Review_Text
1,"September 18, 2019",2,"it works but ""noe gikk galt"" error that follows any interaction with the app and has to be clicked to continue -which brings me back to wherever i wanted to be. doesn't break anything but it is very annoying."
2,"September 15, 2019",1,"this app is worse than ever. it was a downgrade not an upgrade. with their new ""update"" they messed up everything. crashes on start. now i can't login. the button order was switched. no exit option. somebody should test before releasing..."
3,"September 6, 2019",1,crashes on startup. has been doing so for 2 months and no fix has been published. still crashes on startup. am using android 9.1.0 on a bla-l29 (huawei mate 10 pro) phone.
4,"September 13, 2019",3,"nice and clean app, works 90% of the time. but no english version yet."
5,"November 8, 2018",2,"the app from ui experience perspective is simply a mess with illogical navigation and inconsistent design. the main page has a menu toolbar at the bottom which disappears once you click on one of the buttons. the oversikt page is almost identical to the main page, only with different betale, overf칮r...full review"
6,"February 1, 2019",1,"since the last update the app has stopped functioning on my htc u11 it gets to the login screen for fingerprint but does not accept the fingerprint, neither will it log in with the app code. totally broken."
7,"November 27, 2018",2,you ask me to upload some documents but i can't in the app. i only can press last opp and nothing happens...
8,"December 18, 2018",3,is it possible to set default language of app to the english?
9,"September 11, 2019",5,very good app
10,"September 18, 2019",1,"noe gikk galt... slapp av, det er ikke din feil. bla bla bla.... useri칮st 游뱗 bruk hide root, eller bare avinstallere denne sjiten"
11,"September 18, 2019",1,"denne nye, p친st친tt fantastiske versjonen kan vel egentlig oppsummeres slik: ""noe gikk galt""."
12,"September 22, 2019",3,fingerprint reader stopped working on android 10
13,"September 20, 2019",4,"appen funker fint, men syntes vi burde f친 mulighet til 친 ta skjermbilde i appen"
14,"September 19, 2019",1,"veldig glad i sbanken med dere b칮r jo teste ut nye oppdateringer litt mer f칮r de lanseres! krasjer konstant og kommer opp ""noe gikk galt"" hele tiden etter den siste ""oppdatering"" - som jeg egentlig ogs친 synes har en mindre intuitivt ui enn f칮r. dere driver en bank, ikke en snapchat lignende app for ...full review"
15,"September 16, 2019",1,"det er ikke oppgradering men nedgraderingen! har dere ikke testet f칮r dere la den ut for nedlasting? etter ""oppgradering"" klarer man ikke 친 g친 bak n친r man bruke bak knappen eller g친 ut fra appen etter logget seg ut (sitter fast p친 loginn side). h친per dere fikser feilene s친 fort som mulig."
16,"September 17, 2019",1,"var bra. n친 kr칝sjer den for annenhver funksjon 'noe gikk galt, det er ikke fin feil' er ikke en nyttig beskjed! appen har blitt n칝r ubrukelig :-("
17,"September 14, 2019",1,"noe gikk galt, men det er visst ikke min feil. da m친 det v칝re banken sin feil da. ubrukelig etter oppdateringen.."
18,"September 15, 2019",5,"great app, allows you to do anything you need with your bank services."
19,"September 14, 2019",1,"gratulere med ny versjon som fremdeles ikke virker p친 filippinene. og enda en ny versjon som ikke kan aktiveres p친 filippinene. nav, finn, skatteetaten og mange andre klarer 친 sende sms til filippinene. men dere sier det er umulig. inkompetent"
20,"September 13, 2019",5,just what you need to manage your balance account. thank you for making our lifes easier skandiabanken.
21,"September 19, 2019",3,etter ny versjon m친 appen manuelt lukkes hver gang for at fingeravtrykk skal fungere neste gang...
22,"September 13, 2019",5,en fryd i bruk!
23,"September 12, 2019",5,appen har blitt raskere etter siste oppdatering og login med fingeren er veldig praktisk. beste nettbank uten tvil.
24,"September 12, 2019",1,"utrolig treg og lite responsiv, var litt slik f칮r ogs친, men er langt verre etter den nyeste oppdateringen. jeg kan telle til 2 f칮r den reagerer hvis jeg trykker p친 en av menyknappene i bunnen, det er for d친rlig. har en oneplus 5t (android 9, oxygenos 9.0.8)"
25,"June 18, 2019",1,verre og verre for hver oppdatering. skandiabanken hadde den klart beste nettbanken og app. med sbanken blir funksjonaliteten stadig d친rligere. n친 er det s친 d친rlig at jeg ikke engang kan se hva kursen er p친 aksjene jeg kj칮pte mens nettbanken fungerte. etter at de 칮dela funksjonaliteten har jeg ikke ...full review
26,"June 24, 2019",3,savner at appen starter rett i mobilbank->innlogging da det eneste jeg bruker appen til er 친 lese qrkoder for innlogging.
27,"August 2, 2019",4,"works as expected, but 135mb is awful much for what it does."
28,"September 12, 2019",4,min kaspersky sikkerhetspakke slo alarm da jeg oppdaterte. stoler ikke p친 at de har gjort alt  rett i programmeringen. avinstallerte appen
29,"June 13, 2019",4,"sperrer for rootet telefon, ellers er det en bra app. lavere rating grunnet denne sperren."
30,"August 25, 2019",5,utvilsomt den beste mobilbanken p친 markedet.
31,"September 4, 2019",1,slutt 친 send notifikasjon om forbruk pls
32,"September 2, 2019",5,fungerer knirkefritt for meg. mange takk
33,"June 14, 2019",5,bra jobb
34,"September 13, 2019",5,great
35,"February 14, 2019",4,full kollaps etter oppgradering av android. f친r ikke aktivert app. hovedmeny hopp til innholdsbanken feil det oppstod dessverre en feil som medf칮rer at funksjonen du pr칮vde 친 benytte stoppet opp.  edit: ny versjon l칮ste problemet og endrer derfor karakteren.
36,"February 23, 2019",1,f친r ikke opp appen. den g친r bare i st친 . virker rett 친 slett ikke.
37,"March 17, 2019",5,f친r ikke logget inn etter oppgradering til android q
38,"April 3, 2019",5,n친r den fungerer. f친r ikke opp tastatur n친r jeg skal logge inn. litt vanskelig.
39,"January 30, 2019",4,dette er bare noen hurtigknapper til den mobile siden som er langt ifra touch vennlig.
40,"November 30, 2018",5,"f칮rste gang jeg installerte denne appen for ca. et 친r siden, var den helt ubrukelig, n친 fungerer alt som den skal med mindre vedlikeholdsarbeid foreg친r. bra jobba!"
41,"January 4, 2019",5,den beste appen fra en norsk bank. fantastisk lettvint bank og samtidig sikker. for en rask og kundevennlig service i tillegg. hva mer vil man ha
42,"December 26, 2018",5,funker bra.
43,"October 19, 2018",5,works well again
44,"September 17, 2018",4,alt er bra med appen er lit treg og en del lag her og der.. gir den 4 stjern fordi den ikke har st칮tte til wearos (tidligere andriod wear) og ikke noe dark mode/amoled mode skule gjerne likt an intergreing med wallet av budgetbakers. 친 n친e kommer intergreing av coinbase ut av beta?
45,"September 16, 2019",1,"etter at appen ble oppgradert, er det umulig 친 f친 aktivert den."
46,"August 14, 2018",5,fungerer bedre og bedre!
47,"July 13, 2018",2,"n친 funker innlogging ihvertfall, men appen i seg selv er kort sagt, 
uoversiktlig. f칮les ut som jeg scroller milevis nedover, massiv footer som 
ikke har noe i en mobil app 친 gj칮re, hamburger meny p친 feil side, mye 
irrelevant informasjon/reklame blandet inn p친 un칮dige steder. interessant 
fargevalg...full review"
48,"June 15, 2018",3,":-( hva er greia med 친 ha hamburger menyen p친 h칮yre side? den lagger now 
grusomt ogs친. er ikke helt enig med det nye designet, men venner sikker meg 
til det. men flytt burgeren. og hvorfor kan jeg ikke bruker fingeravtrykk 
for 친 logge inn via qr kode?"
49,"June 15, 2018",5,"slutta 친 funke p친 oppdateringa i dag. har en motorola moto g4 plus. appen 
er kjempefin da!"
50,"September 12, 2018",2,kan ikke ta skjerm bilde lenge. funket f칮r. derfor vanskelig 친 oppf칮lge mine fond bevegelse :(
51,"April 11, 2018",3,"""bekreft opplysninger""  ogs친 kommer man ikke videre selv om jeg velger ""jeg bekrefter...."" og trykker p친 bekreft."
52,"April 29, 2018",3,"ok, fungerer omsider p친 android 7.1 i det minste. lurer p친 hvor lenge det varer denne gangen..."
53,"April 7, 2018",5,fungerer flott
54,"March 23, 2018",5,"suveren bank med bra app, brukervennlig og n칝rmest full funksjonalitet som i nettleser."
55,"December 29, 2017",2,"takler ikke 친 bli minimert. ender ofte opp med hvit skjerm, og eneste l칮sning er 친 swipe bort appen og starte p친 nytt. navnebyttet har 칮delagt mobilbanken."
56,"December 21, 2017",3,"the app works, you have to click through quite a lot to get to where you want to be. certainly not a great app but it let's you do most things in the app so you can do your finances."
57,"January 9, 2018",2,alt som har med aksjer og fond er blitt veldig uoversiktelig og knotete.. her er det virkelig potensial til forbedring. for칮vrig er appen god
58,"February 14, 2018",4,"beste nettbanken i norge, ihvertfall av de jeg har pr칮vd."
59,"February 6, 2018",4,"fin app, men 칮nsker meg ogs친 app for android wear til 친 sjekke saldo, og adaptivt ikon :)"
60,"December 15, 2017",5,"flott app; ryddig, oversiktlig, rask og presis. innlogging med fingeravtrykk gj칮r dette til en raskere m친te 친 sjekke status p친 konto enn web. tilpassing av app ikon til android 8.0 gjenst친r, i mitt tilfelle rundt ikon."
61,"December 17, 2017",2,skj칮nner ikke helt hvorfor dere endret den forrige appen. for den her krasjer veldig ofte. og den er mye tregere. har m친ttet resete appen mange ganger. veldig d친rlig
62,"December 15, 2017",1,can you please translate the app to english?! it shouldn't be that hard and nowadays it should be mandatory. a lot of expats like me are finding it very hard to deal with this. as an example in the netherlands almost everything is translated to english including offcourse the mobile banking apps. th...full review
63,"December 14, 2017",4,"ny fargepalett gj칮r navigering ""tregere"" - men fortsatt milevis forran andres fors칮k p친 nett/mobil bank 仇벒잺 fingeravtrykkinnogging er fikset i dagens versjon 鮫봺잺"
64,"December 11, 2017",2,problemene med innlogging etter at den har ligget i bakgrunnen en stund er vell et kjent problem for dere. n친r er det planlagt fikset?
65,"December 12, 2017",2,the log in page freezes therefore i can't log in to the app. i never had a problem like this with skandiabanken app. please do something about this.
66,"December 12, 2017",1,"tidligere var skandiabanken sin mobilapp helt suveren. den s친 bra ut, og viktigst av alt - den fungerte. etter de byttet profil til spanken har alt g친tt til helvete. den ser ikke ut, har blitt tregere og tregere, og n친 f친r jeg ikke logget inn en gang."
67,"December 14, 2017",2,"bra bank, men appen m친 avsluttes hver gang jeg vil logge inn, ved neste oppstart g친r det som regel bra."
68,"December 12, 2017",1,nye appen er helt forferdelig d친rlig. her blir det bytting av bank
69,"December 13, 2017",1,fix your login bug! this is unacceptable!
70,"December 4, 2017",5,har 0 problemer. synes nye appen er mye bedre jeg.
71,"December 4, 2017",1,viser ikke changelog ved oppdatering. treg og bruker mye str칮m.
72,"December 12, 2017",1,hadde v칝rt fint 친 f친tt logga inn da
73,"December 12, 2017",1,"treg, kan ikke aktivere meg. bortkastet tid."
74,"December 3, 2017",1,"my eyes hurt so much looking at this horrible app. the green colour on white combination fails every wcag accessibility test. there are online tests for it, i can't  believe it is so bad. whoever picked the colour combination should be fired."
75,"November 25, 2017",1,"kr칝sjer alt for ofte, spesielt etter at appen kom i  ny drakt ifm. navnebyttet. nye versjoner til stadighet, uten at problemene noen ende vil ta. n친 m친 dere fikse appen en gang for alle, ellers ryker dere p친 en smell i kundetilfredshet."
76,"November 24, 2017",2,"denne nye appen er veldig treg i forhold til den gamle, og ofte klager den p친 nettverksproblemer ved oppstart.. m친 ofte restarte appen. likte den gamle bedre. rart om de har ny kodebase, da det kun er navnebytte og endring av grafisk profil."
77,"December 1, 2017",2,etter oppdatering til sbanken har appen sluttet 친 fungere etter 친 ha v칝rt i dvale. m친 avsluttes og restartes.
78,"December 4, 2017",3,innlogging med fingeravtrykk har ikkje fungert etter navnebytte (huawei nexus 6).  solid app ellers.
79,"November 22, 2017",5,funker bra!
80,"November 20, 2017",1,"the skandia app used to be smooth as silk but the last few updates have led to erratic performance at best. now i am unable to get further than a late ""s"" logo. please fix asap!"
81,"November 14, 2017",3,kr칝sjer regelmessig hvis man bytter mellom forskjellige nett (4g->wifi / wifi1->wifi2 osv) og m친 lukkes og gjen친pnes for 친 fungere. fiks dette v칝r s친 snill. ogs친 enig med andre - hamburgeren m친 til venstre!
82,"November 20, 2017",1,"sluttet 친 funke etter navnebytte, har pr칮vd 친 reinstallere. f친r bare opp logo..."
83,"November 20, 2017",1,stopped working after they changed to sbanken. now it only shows the logo.
84,"November 16, 2017",1,og da er vi igang igjen med feil under innlogging.. problemer ved oppstart. alltid problemer hvis jeg ikke restarter appen :/
85,"November 20, 2017",1,"funker ikke etter navnebytte, bare logo, kommer ikke lenger"
86,"November 16, 2017",1,"det er rett og slett ganske imponerende hvor mye d친rligere appen ble etter bytte av navn.. n친r jeg starter appen n친 er det typisk slik at den ikke vil lese fingeravtrykk, s친 trykker jeg avbryt og logger p친 med app-kode, det gir en feilmelding.. s친 fors칮ker jeg p친 fingeravtrykk igjen og f친r meldingen...full review"
87,"November 16, 2017",2,"problemer oppst친r hver gang jeg 친pner appen. m친 ""pr칮ve p친 nytt"", ""oi! now gikk galt""-melding. plagsomt"
88,"November 20, 2017",1,starter ikke engang. funket et par ganger og st친r n친 bare fast p친 logoskjermen.
89,"November 20, 2017",1,was very good and flawless before sbanken. now today it is just showing logo. please fix. hope you have smooth transition
90,"November 20, 2017",5,"okay, n친 ser jeg kun logoen. kommer ikke videre."
91,"November 20, 2017",1,"kommer ikke lengre enn til s'en, hva er det dere driver med?!"
92,"November 20, 2017",1,"var god f칮r, har blitt ille etter oppdateringer siste ukene."
93,"November 20, 2017",1,irriterende ofte den helt enkelt ikke funker.. ellers grei
94,"November 20, 2017",1,"virker ikke lenger, henger p친 s-logoen."
95,"November 21, 2017",4,virker igjen. fint.
96,"November 6, 2017",2,"visuelt ok, men flyt hamburgermenuen til venstre side s친dan som for alle andre android apps. nu er det h친bl칮st vanskeligt at betjene appen med en h친nd."
97,"November 2, 2017",5,app is working again. god work fellas!
98,"November 5, 2017",5,beste banken. bra app. funker som regel helt supert
99,"October 31, 2017",1,"latest version doesn't work on s7 edge, when it worked it was a nice app."
100,"October 31, 2017",2,worked fine until last release. now doesn't start at all.  v 3.4.4
101,"October 31, 2017",5,i like this app游녨
102,"October 21, 2017",1,after latest upgrade won't open
103,"October 24, 2017",3,"siste oppgradering kr칝sj: ""404: file or directory not found"""
104,"June 19, 2017",2,det er umulig 친 betale regninger siden man ikke kan bytte mellom apper uten at den logger ut. kan da ikke kopiere kid etc fra mail p친 telefonen.
105,"January 19, 2017",5,"st칮tter ikke android n. appen 친pner, men det er bare svart."
106,"July 30, 2017",1,"veldig irriterende at man blir logget ut om man m친 hente kontonr eller kid fra andre apper, nettsider eller epost. dette har aldri v칝rt et problem i andre mobilbank apper. dette m친 fikses! det m친 g친 an 친 betale regninger p친 mobilen uten penn og papir!! alt for d친rlig. samsung s8."
107,"August 14, 2017",3,"kan man bruke denne appen selv om man har en annen bank? bruker ikke scandia banken, men har lyst 친 bruke denne appen, er det mulig?"
108,"December 20, 2016",1,"f친r ikke registrert,  f친r feilmelding."
109,"October 13, 2017",4,add english language option please!
110,"December 30, 2016",1,doesn't even start.
111,"October 13, 2016",5,칮nsker meg innlogging med fingeravtrykk ogs친 p친 qr-kode og egen snarvei fra hjemskjerm til qr-kode. naturlig app shortcut i android 7.1?
112,"September 16, 2016",4,edit: kom ny oppdatering n친. n친 fungerer det igjen
113,"September 28, 2016",5,"glimrende app. oppdatering med innloggingsproblemer ble raskt rettet opp, og alt fungerer som vanlig n친."
114,"September 18, 2016",4,nice :)
115,"August 24, 2016",3,"og fingerleseren i samsung s7 er ikke st칮ttet. trekt 1 stjerne for hver s친 3 av 5 """"geit nokk men burde v칝rt mye bedre"""
116,"September 10, 2016",2,det er totalt t칮v og useri칮st at en app vurderer cm som en usikker android versjon. p친 mine enheter som er noen 친r gamle er det kun cm som er oppdatert. alternativet er android 4 som ikke har f친tt noen som helst oppdateringer fra hardwareprodusenten p친 over 18-20 m친neder. n친 kj칮rer jeg en oppdatert ...full review
117,"August 23, 2016",5,"fungerer veldig bra, og n친 ogs친 p친 android 7"
118,"October 18, 2016",1,hei skandiabanken dere trenger ikke mobilstatus
119,"August 28, 2016",5,veldig veldig topp topp 游녨游녨游녨游녨
120,"August 23, 2016",5,perfect!
121,"August 19, 2016",1,"etter nedlasting alt greit men saa kommer en lang aktiveringskode paa sms som jeg maa lese to ganger, jeg maa ut av denne appen for aa lese sms saa maa man begynne alt paa nytt ved aa gaa tilbake til denne appen,"
122,"June 23, 2016",1,og hva skal dere med kontaktlista mi?
123,"September 2, 2016",2,"bra app. men begrensende med kun 3 enheter. har et par mobiler og et par nettbrett i ulik st칮rrelse. fint om qr login kunne automatiseres, dvs starter man p친logging p친 web og man s친 starter app s친 ville det v칝rt fint om  man slapp 친 velge qr i menyen."
124,"August 23, 2016",5,"fungerer endelig med android n, hvorfor ventet dere s친 lenge?"
125,"August 22, 2016",4,i dag kom offisiell android 7 og appen fungerer fortsatt ikke. litt skuffende
126,"August 23, 2016",5,endelig. takker og bukker!!
127,"July 29, 2016",4,kjempeforn칮yd med appen.
128,"February 11, 2016",4,"appen har blitt veldig bra, og qr innlogging er genial. det er dog et behov for 친 oppdatere til 친 bruke ny kamera api da det gamle kamera apiet ikke plukker opp at sensoren p친 nexus 5x med flere ikke er montert p친 den mest vanlige m친ten. resultatet er at kamerabildet er opp ned og speilvendt."
129,"May 22, 2016",3,the app stops working after updating to android n public beta version. please fix.
130,"February 29, 2016",5,"flott, bra dere skj칮nte at custom rom ofte er sikrere enn gammel utdatert stock rom. appen deres er knall, og vi alle fortjener 친 benytte den ogs친 p친 moddet telefon :)  tommel opp for at dere lyttet!"
131,"June 29, 2016",1,hvorfor? det er kjedelig at jeg ikke kan oppgradere og i fremtiden ikke kan installere en app jeg har nytte av.
132,"July 17, 2016",3,enkel og brukevennlig app som gj칮r jobben: 5 stjerner. ber om 친 se kontaktlista uten gyldig grunn i oppdatering: -2 stjerner.
133,"June 30, 2016",2,"hvorfor trenger siste versjon tilgang til mine kontakter? gi meg banktjenester, slutt 친 snoke."
134,"November 26, 2015",5,"skandiabanken har gjort en god jobb med denne appen. rask og enkel innlogging, samt godt ui. inntil nylig problematisk at de nektet tilgang fra rootede enheter, men det er alts친 n친 fikset."
135,"March 31, 2016",3,har samsung galaxy s6. appen nekter ofte 친 logge inn. aksjedelen er ekstremt treg og har ikke rt-kurser selv om de p친st친r det. ellers er grensesnittet bra.
136,"September 30, 2016",1,"eh, nei. autoupdate skrudd av for denne."
137,"June 17, 2016",3,fungerer ikke p친 nexus 6p med android n.
138,"January 8, 2016",5,"fungerer som den skal, og den funger bra."
139,"November 24, 2015",5,bruker ikke appen til s친 mye annet
140,"November 28, 2015",4,beste m친ten 친 g친 i banken
141,"March 9, 2016",5,really like it . much better than competition
142,"June 24, 2016",4,an english version would be much anticipated.
143,"February 11, 2016",4,fungerer bra
144,"October 12, 2015",5,takk for at dere endret s친 vi med roota telefoner kan bruke appen igjen. n친 slipper jeg nok en gang treg mobilbrowser innlogging! :)
145,"November 2, 2015",1,"can't open it. have a nexus 6. shows ""installed"" in google play store but when i press ""open"" a logo shows but nothing happens. it seems to be loading but it goes on forever without it opening.."
146,"October 28, 2015",5,best thing since sliced bread!
147,"October 30, 2015",5,bra n친 som roota telefoner st칮ttes
148,"October 14, 2015",5,"游녧det beste banken, lett 친 bruke 游녪"
149,"October 19, 2015",5,veldig stabil app'en游녧游녨游녨
150,"September 27, 2015",4,"hadde v칝rt fint om haptic feedback under p친logging hadde v칝rt valgfritt... det er bare irriterende og un칮dvendig...synes jeg.. ellers ingen problemer. er det noen fornuftig grunn til at jeg ikke f친r lov 친 ta screenshot ? finnes ikke noe historikk p친 fondssparing, og n친 m친 en logge inn via nettleser ...full review"
151,"September 29, 2015",3,"n친r man f칮rst er inne, s친 er det en helt middels wrapping av websider. men litt irriterende 친 m친tte starte den to-tre ganger f칮r det virker."
152,"September 10, 2015",2,"appen henger seg  opp og starter ikke,  samsung galaxy s3, hat fungert bra f칮r"
153,"September 18, 2015",4,de har fikset det tullet med root:)
154,"September 9, 2015",4,oppdatert: treghetene er fikset :)
155,"August 5, 2015",5,"logger nesten ikke p친 nettsidene lenger, og ser at jeg har mye lettere banktilgang enn min samboer som har sparebank 1 (hvor hun av alle ting m친 bruke en kodebrikke)"
156,"August 5, 2015",4,men ved innlogging f친r jeg av og til opp et glimt av en melding hvor det st친r hej... og ett eller annet med tjuven. har resatt telefon og f친r den fortsatt. hva kommer det av?
157,"August 28, 2015",2,"fors칮ker 친 aktivere, men det g친r s친 tregt (henger) n친r jeg fors칮ker 친 skrive inn f칮dselsdato, og jeg f친r aldri skrevet alle sifrene i f칮rste felt. to stjerner fordi jeg har brukt det f칮r p친 en annen telefon, og likte det."
158,"August 5, 2015",4,nesten mer brukt enn nettsiden for min del. f친r unnagjort en god del!
159,"September 1, 2015",1,"funker ikke, for treg for 친 kunne brukes."
160,"August 18, 2015",5,takk!
161,"July 6, 2015",3,"har blitt ganske bra, men blir utrolig provosert over at man blir p친tvunget haptic feedback under p친logging. at appen liksom ikke virker p친 rootede telefoner er kun pga sluttbrukers kompetanseproblem."
162,"June 27, 2015",2,syntes appen var veldig fin. trist at skandiabanken ikke lar appen fungere med root. derfor bare en stjerne. ikke noe forskjell i sikkerhetsniv친.
163,"June 30, 2015",1,blir bare dumt 친 skylde p친 root istedenfor 친 faktisk lage en app som er sikker......
164,"April 30, 2015",1,just recieved a message telling me app will not work on rooted phone from 1st may. time to uninstall app and change banks.
165,"June 8, 2015",1,stopped working some time in may. the phone is not rooted. enjoyed it before that. used to be very convenient.
166,"July 15, 2015",4,veldig fin app. fungerer igjen med rooted telefon uten 친 m친tte skjule root. f친r bare opp en advarsel. :)
167,"July 21, 2015",1,"f친r ikke startet aktivering, appen blir treg og henger n친r jeg kommer til inntasting av mobilnummer og f칮dselsdato. samsung s6"
168,"June 24, 2015",1,ergo verdil칮s for folk som 칮nsker kontroll over sine enheter ved 친 kj칮re f.eks cyanogenmod.
169,"June 26, 2015",1,suddenly no access if the phone is rooted. time to change banks.
170,"July 2, 2015",1,vet dere hvor mange har root android ? vet dere hvor mye enklere fungerer mobilene? vet dere at st칮rste sikkerhet antivirus apper funker fint p친 root uten noe 친 si ?
171,"May 23, 2015",4,fikk ogs친 melding om at den ikke skulle funke p친 rootet telefon etter 1. mai. skriver n친 23. mai. funker fint fra rootet telefon :-)
172,"July 31, 2015",1,kommer ikke engang inn i appen p친 min galaxy s6. treg og henger.
173,"June 27, 2015",1,fungerer ikke lenger. er rootet. h친per p친 en workaround
174,"July 5, 2015",1,fungerer ikke p친 cyanogen11 med root. t칮vete avgj칮relse fra skandiabanken.
175,"July 1, 2015",2,dumt 친 lage en app som ikke virker med root
176,"July 26, 2015",3,det er fint applikasjoner men noen ganger det er d친rlig
177,"July 5, 2015",1,fungerer ikke i det hele tatt p친 cyanogenmod.
178,"June 29, 2015",1,virker ikke lenger pga root.
179,"July 2, 2015",1,virker ikke p친 cyanogenmod.
180,"June 24, 2015",1,tsk tsk.
181,"July 17, 2015",4,got root?
182,"June 24, 2015",1,root
183,"April 4, 2015",3,fikk melding om at appen ikke kan brukes etter 1.mai viss telefonen er rootet. s친 da blir det 친 slette den. trenger root for 친 ta skikkelig backup av telefonen.
184,"April 15, 2015",3,hver gang jeg trykker p친 meny knappen s친 vises menyen i et 칮yeblikk f칮r den lukker seg selv.  samsung s3
185,"March 21, 2015",1,"krasjer med en gang, s3 4.3 jelly bean."
186,"April 8, 2015",2,bare crasher for meg
187,"April 27, 2015",1,krasjer med en gang.
188,"February 9, 2015",2,"henger p친 oppstart, f친r ikke brukt den..."
189,"February 3, 2015",1,"it used to work fine, till the last updates. now nothing works. always need to do a  force stop before using the app. very annoying. useless app."
190,"February 8, 2015",1,"android 4.4.2 p친 en samsung galaxy s4 active (gt-i9295). appen har fungert i perioder, men n친 st친r den bare og laster hele tiden og gir meg ikke muligheten til 친 logge inn. helt ubrukelig. er mye raskere 친 bare finne en pc og logge p친 nettbanken via sms, kontra dette tullet her. amat칮rmessig kodet."
191,"February 5, 2015",1,appen har jo krasjet helt n친
